type	index	image	question	A	B	C	D	answer
pg	933	data/figure/pg/2023-02-17--小金属-中国稀土-公司深度报告：中国稀土：整合开启，掌控提升_page12_图142022年离子型稀土开采控制指标折REO吨.jpg	根据图中的数据，哪个集团的稀土开采控制指标占比最高？	中国稀土集团	厦门钨业	广东省稀土产业集团		A
pg	934	data/figure/pg/2022-12-05--工程建设-山东路桥-交通强省潜力十足，山东基建龙头再腾飞_page8_图表102022H1各项业务营收占比.jpg	在2022年上半年，山东路桥的主营业务中，哪一项业务的营收占比最高？	设备租赁	养护工程	路桥施工		C
pg	935	data/figure/pg/2022-12-20--包装材料-昇兴股份-核心客户放量+产能持续提升，业绩有望快速释放_page12_no_caption.jpg	根据图中的数据，哪个品牌的业务占比最大？	红牛	东鹏特饮	中沃		A
pg	936	data/figure/pg/2024-01-18--贵金属-湖南黄金-金锑双轮，驱动成长_page7_图表82022年金饰占黄金总量的46.jpg	根据图中的数据，金饰的占比是多少？	2%	15%	46%		C
pg	937	data/figure/pg/2022-12-13--半导体-长川科技-长川科技：国产测试机龙头，内生+外延铸就高成长_page8_图表112021年全球测试机龙头市场份额排行.jpg	根据图中数据，哪个公司的市场份额最大？	泰瑞达	爱德万	科休		A
pg	938	data/figure/pg/2023-12-15--软件开发-中控技术-纵向拓品类，横向拓行业，智能制造平台级巨轮驶向世界_page8_图表92023H1智能制造解决方案占比达到五成以上.jpg	根据图中的业务占比情况，智能制造解决方案的占比为多少？	53.80%	18.60%	2.90%		A
pg	939	data/figure/pg/2022-12-28--小金属-博迁新材-高端粉体材料平台企业雏形已现_page7_图表132020年中国电容器市场结构分布.jpg	以下哪种电容器在中国电容器市场中占比最高？	陶瓷电容器	铝电解电容器	薄膜电容器		A
pg	940	data/figure/pg/2022-12-04--电网设备-四方股份-电网二次平台型龙头，新能源+储能注入发展新动能_page12_图132022年19月国网变电监控系统中标情况.jpg	如果南瑞的中标金额为32亿元，那么四方的中标金额是多少？	19.2亿元	15.6亿元	18.4亿元		A
pg	941	data/figure/pg/2023-12-13--电子元件-隆扬电子-国内垂直电磁屏蔽材料供应商，拓展复合铜箔储备新增长级_page7_图62023H1公司主营业务收入构成.jpg	如果电磁屏蔽材料的市场份额减少5个百分点，其新份额是多少？	77.71%	82.71%	87.71%		A
pg	942	data/figure/pg/2023-09-18--家电行业-极米科技-公司半年报：收入利润底部继续承压，静待需求回暖_page4_评级分布RatingDistribution.jpg	根据最新季度的评级分布，'优于大市'的占比是多少？	89.60%	9.20%	1.10%		A
pg	943	data/figure/pg/2023-03-06--家电行业-德业股份-逆变器后起之秀，拓展光储赛道迎新发展_page16_图312021年欧洲户储PCS10kw以内竞争格局.jpg	根据图中的业务占比情况，华为的市场份额是首航新能源的多少倍？	约1.7倍	约1.6倍	约1.5倍		A
pg	944	data/figure/pg/2023-10-07--通信设备-天孚通信-光模块OMS一站式平台扩张，受益于光电合封时代供应链格局变化_page9_图表11无源器件在光模块BOM成本占比以400GQSFPDDDR4为例.jpg	在400GQSFPDDDR4光模块的BOM成本中，哪个部分的成本占比最高？	电路板（MCU、DCDC、DSP等）	光学封装基板	InP激光器		A
pg	945	data/figure/pg/2023-12-06--医疗器械-春立医疗-关节领域国产领头羊，集采影响逐渐出清_page22_图432018年骨科医疗器械分地区收入占比情况.jpg	2018年骨科医疗器械收入占比最高的地区是？	北美	欧洲	亚太		A
pg	946	data/figure/pg/2023-09-17--软件开发-金橙子-公司首次覆盖报告：激光振镜控制系统领军企业，国产替代+新品拓展打开成长空间_page19_图36中国3D打印服务市场规模占比远超其他部分.jpg	根据图中的业务占比情况，3D打印服务的占比为多少？	40.90%	22.42%	17.04%		A
pg	947	data/figure/pg/2023-11-08--化学制药-千红制药-肝素和蛋白酶龙头之一，加速创新化转型_page9_图112021年样本医院依诺肝素市占率.jpg	如果赛诺菲的市场份额减少5个百分点，其新份额是多少？	39%	40%	41%		A
pg	948	data/figure/pg/2023-11-27--煤炭行业-华阳股份-公司首次覆盖报告：华阳股份：立足煤炭主业，积极转型发展_page11_图172023年19月各省无烟煤产量占比情况.jpg	根据图中数据，哪个省份的无烟煤产量占比最高？	山西	贵州	河南		A
pg	949	data/figure/pg/2023-05-31--化学原料-宿迁联盛-国内受阻胺光稳剂龙头，两大基地拓展产业链布局_page16_图表202020年全球光稳定剂主要产品结构.jpg	根据图中的产品结构，受阻胺类产品的占比是紫外线吸收剂的多少倍？	约3.24倍	约2.15倍	约1.87倍		A
pg	950	data/figure/pg/2023-01-19--互联网服务-宝信软件-深度报告（2）：国之重器，高端智能制造龙头肩负使命，巨舰起航_page98_图129宝信软件客户结构持续优化和盈利能力持续提升.jpg	宝信软件的客户中，哪个客户的占比最高？	腾讯	阿里、腾讯、360	中国太保		A
pg	951	data/figure/pg/2022-11-21--航运港口-招商南油-中国出口提振市场，“东油西运”趋势不变_page9_图15欧洲成品油进口情况百万吨.jpg	欧洲成品油进口中，俄罗斯的市场份额占比是多少？	38.40%	26.90%	16.40%		A
pg	952	data/figure/pg/2024-03-07--医疗器械-振德医疗-国内海外双轮驱动，“医疗+健康”引领长期发展_page22_图2023上半年收入结构.jpg	振德医疗的哪一项业务占比最高？	手术感控	基础伤口护理	造口及现代伤口护理		A
pg	953	data/figure/pg/2023-02-13--燃气-天壕环境-稀缺管输资产打通上下游，多重盈利模式有望助力业绩增长_page11_图172021年公司前五大客户情况.jpg	根据图中的客户占比情况，国家电投集团山西铝业有限公司与山西华兴铝业有限公司的占比差距是多少？	16.49%	17.49%	18.49%		A
pg	954	data/figure/pg/2023-11-08--化学制药-千红制药-肝素和蛋白酶龙头之一，加速创新化转型_page10_图122022年我国依诺肝素注射液市场格局.jpg	根据图中的市场格局，哪个品牌的依诺肝素注射液市场份额最大？	克赛	普洛静	亿喏佳		A
pg	955	data/figure/pg/2023-10-07--电子化学品-广钢气体-以氦为矛，电子大宗气体领军者_page19_no_caption.jpg	根据图中资源量的分布，哪个国家的资源量占比最高？	美国	卡塔尔	阿尔及利亚		A
pg	956	data/figure/pg/2022-12-22--工程建设-中国化学-深度报告之二：新能源材料的技术供应商_page45_图表煤电项目度电成本拆分以动力煤价格1200元吨为例.jpg	如果将成本折旧和其他成本合并为一个类别，其总占比为多少？	11%	10%	9%		A
pg	957	data/figure/pg/2023-08-09--玻璃玻纤-凯德石英-北交所个股研究系列报告：石英玻璃制品企业研究_page12_图表222021年中国地区石英制品竞争企业竞争格局.jpg	根据图中的市场份额情况，杭州大和热磁与沈阳贺利氏信越的市场份额差距是多少？	5.15%	4.87%	5.32%		A
pg	958	data/figure/pg/2023-08-01--生物制品-锦波生物-功能蛋白一体化龙头，薇旖美快速放量驱动增长，敷料护肤前景可期_page13_图162021年中国功效性护肤品竞争格局.jpg	以下哪个公司的市场份额最大？	公司A（云南，植物精华成分提取物、透明质酸、胶原蛋白）	巨子生物	公司D（日本，氨基酸、神经酰胺）		A
pg	959	data/figure/pg/2022-10-24--纺织服装-新澳股份-深度报告：多品类宽带发展，毛纺龙头量价齐升成长可期_page14_图272021年国内头部毛纺企业收入构成情况.jpg	在2021年，新澳股份的毛精纺纱业务收入占比与羊毛毛条业务收入占比相比如何？	毛精纺纱业务收入占比更高	羊毛毛条业务收入占比更高	两者收入占比相同		A
pg	960	data/figure/pg/2024-01-01--半导体-聚辰股份-深度报告：DDR5渗透加速，SPD、车规级EEPROM驱动成长_page12_图222023年全球EEPROM市场格局.jpg	如果意法半导体的收入为31亿元，那么Microchip的收入是多少？	20.7亿元	9.3亿元	22.1亿元		C
pg	961	data/figure/pg/2022-12-19--农牧饲渔-隆平高科-深度报告：乘转基因政策春风，种业龙头蓄势待发_page7_图152020年中国杂交玉米种业市场竞争格局.jpg	隆平高科和登海种业的市场份额总和占整个市场的比重为多少？	8%	10%	11%		C
pg	962	data/figure/pg/2023-06-21--电源设备-东方电气-火电核电重启电不荒，加码绿能奔向碳中和_page33_图742022年火电发电量占比较2016降低46风电提高46.jpg	根据图中的数据，2016年火电发电量的占比为多少？	74.40%	69.80%	17.80%		A
pg	963	data/figure/pg/2022-12-11--互联网服务-太极股份-公司首次覆盖报告：数字政府建设迎东风，信创业务发展正当时_page10_图20慧点科技在中国企业团队协同软件市场传统部署模式份额为148.jpg	根据图中的市场份额情况，泛微的市场份额为多少？	22.30%	21.60%	14.80%		A
pg	964	data/figure/pg/2023-08-24--工程机械-浙江鼎力-全球高空作业平台龙头，受益海外高景气及臂式产品放量_page11_图172021年全球高空作业租赁主要市场设备保有量及占比单位万台.jpg	根据图中数据，哪个地区的高空作业租赁设备保有量占比最高？	北美洲	亚太	EAME		A
pg	965	data/figure/pg/2023-06-12--农药兽药-绿亨科技-农药+种子双驱动企业研究_page9_图表162021年全球作物用农药市场品种结构.jpg	2021年全球作物用农药市场中，除草剂的市场份额占比是多少？	25%	44%	27%		B
pg	966	data/figure/pg/2023-12-11--电网设备-科陆电子-美的入主，发力储能_page17_图202022年美国储能装机类型占比.jpg	根据饼图，哪一种储能类型占比最大？	表前储能	户用储能	工商业储能		A
pg	967	data/figure/pg/2023-06-15--医疗器械-浩欧博-首次覆盖报告：过敏自免两翼齐飞，行稳致远进而有为_page11_图162018年中国过敏市场竞争格局.jpg	如果外资企业（以欧蒙、敏筛和Phadia为主）与浩欧博合并，占有率将达到多少？	51.00%	70.00%	80.00%		B
pg	968	data/figure/pg/2023-01-01--化学制品-鼎际得-国产聚烯烃催化剂龙头蓄势待发_page10_图表162021年我国均聚共聚PP的产量占比.jpg	根据图中的产量占比情况，无规共聚聚丙烯的产量占比是抗冲共聚聚丙烯的多少倍？	0.5倍	0.4倍	0.6倍		B
pg	969	data/figure/pg/2023-09-17--专用设备-欧克科技-造纸设备龙头企业，跨界进入隔膜设备新领域_page25_图表42下游造纸行业集中度.jpg	如果CR4的市场份额增加5个百分点，其新份额是多少？	35.71%	30.71%	25.71%		A
pg	970	data/figure/pg/2023-04-05--证券-中原证券-2022年报点评：全年业绩承压，资管业务成为亮点_page1_图1中原证券2022年收入结构.jpg	根据图中的业务占比情况，经纪业务与自营的占比差距是多少？	5%	4%	6%		A
pg	971	data/figure/pg/2023-07-31--物流行业-永泰运-深度报告：千亿赛道消费升级，区域龙头扬帆奋楫_page38_图表58相关行业财务情况对比.jpg	根据饼图，哪种业务的销售净利率最高？	化学品仓储	化学品水运	化工供应链		C
pg	972	data/figure/pg/2023-12-24--汽车零部件-瑞鹄模具-背靠奇瑞的冲压模具隐形冠军，向下游拓展轻量化零部件业务打开增长空间_page8_图表162022年国内汽车冲压模具市场格局.jpg	根据图中的市场份额情况，瑞鹄模具的市场份额为多少？	2.75%	1.58%	0.86%		B
pg	973	data/figure/pg/2023-09-12--有色金属-云海金属-2023年中报点评：镁价企稳，Q2业绩环比改善_page2_图12023H1分产品营收占比.jpg	根据图中的业务占比情况，镁合金产品的占比是铝合金产品的多少倍？	2.5倍	3倍	4倍		A
pg	974	data/figure/pg/2023-03-07--电子元件-三环集团-陶瓷材料专家，丰富产品线贡献多维业绩增量_page10_图表19全球电子陶瓷产业链2021.jpg	根据图中的上游陶瓷粉体市场份额，哪个国家或地区的公司占比最高？	日本	美国	欧洲		A
pg	975	data/figure/pg/2022-10-14--通用设备-祥鑫科技-首次覆盖报告：好赛道搭配好客户，新能源助推快成长_page17_图14逆变器成本结构.jpg	如果机构件的成本增加20%，其在总成本中的占比将变为多少？	30%	28%	26%		A
pg	976	data/figure/pg/2023-10-04--酿酒行业-今世缘-深度报告：乘势而起，百亿新征程_page25_图432022年公司产品结构.jpg	根据饼图，特A+类产品的市场份额占比是多少？	66%	27%	4%		A
pg	977	data/figure/pg/2022-12-26--有色金属-新锐股份-公司首次覆盖报告：具备全球竞争力的矿用工具龙头，硬质合金一体化先行者_page5_图82020年碳化钨原材料占比约60.jpg	根据图中的数据，碳化钨粉的占比是多少？	58.59%	9.69%	8.42%		A
pg	978	data/figure/pg/2023-07-27--交运设备-朗进科技-公司首次覆盖报告：轨交空调龙头出海寻增量，热泵烘干与储能温控带来发展新机遇_page15_图242020年热泵烘干机广泛运用于三大产业.jpg	根据图中的数据，热泵烘干机在第一产业的占比是多少？	20%	60%	40%		B
pg	979	data/figure/pg/2024-02-27--电力行业-中国广核-全国核电龙头，业绩持续增长的现金“牛”_page26_图352023年我国在运核电机组装机分布.jpg	2023年我国在运核电机组装机分布中，排名前两位的企业市场份额总和占整个市场的比重为多少？	95.20%	85.20%	75.20%		A
pg	980	data/figure/pg/2023-12-06--汽车零部件-伯特利-首次覆盖报告：线控制动领跑者，布局底盘一体化打开成长空间_page26_图39中国市场乘用车EPB系统供应商2021年前装市场份额.jpg	2021年中国市场乘用车EPB系统供应商中，市场份额最高的企业是？	采埃孚	大陆集团	ADVICS		A
pg	981	data/figure/pg/2022-11-30--珠宝首饰-中国黄金-央企黄金珠宝龙头，培育钻石迎来新契机，静待发布_page10_图152021年中国黄金珠宝市场份额占比情况.jpg	2021年中国黄金珠宝市场中，黄金的市场份额占比是多少？	60.13%	13.97%	11.99%		A
pg	982	data/figure/pg/2022-12-31--汽车零部件-科博达-深度报告之二：打造域控制器平台型企业_page9_图8公司2021年分产品毛利.jpg	根据图中的数据，以下哪项描述最符合2021年分产品毛利的结构？	照明控制系统占总毛利的47%	能源管理系统占总毛利的19%	车载电器与电子占总毛利的22%		A
pg	983	data/figure/pg/2023-02-22--软件开发-金山办公-国产办公软件龙头，订阅和信创打开长期增长空间_page8_图表12C端收入是公司的基本盘截至2022年Q3.jpg	截至2022年Q3，金山办公的个人订阅收入占比为多少？	52%	23%	17%		A
pg	984	data/figure/pg/2022-12-22--工程建设-中国化学-深度报告之二：新能源材料的技术供应商_page27_图表成达公司纯碱技术领先.jpg	成达公司纯碱技术传承了多少年？	30+	50+	60+		C
pg	985	data/figure/pg/2022-12-01--燃气-新奥股份-天然气一体化龙头，波动局势中稳健发展_page5_图32019年公司营收构成.jpg	根据图中数据，以下哪个行业在2019年公司的营收占比最高？	化工贸易	工程施工与安装	能源化工		A
pg	986	data/figure/pg/2024-01-19--中药-马应龙-肛肠品牌老字号，打造“医+药+养”结合新模式_page12_图表132020年中国痔疮用药市场细分药品类型占比.jpg	根据图中的药品类型占比情况，哪种药品类型的占比最高？	乳膏剂	栓剂	贴膏		A
pg	987	data/figure/pg/2023-09-24--有色金属-同享科技-光伏焊带领军企业，N型新品加速放量_page9_图12光伏焊带的分类.jpg	图中哪一项成本占比最大？	直接材料	制造费用	运输费用		A
pg	988	data/figure/pg/2023-07-07--贵金属-紫金矿业-资源布局加速，矿业龙头稳固_page14_图表242021年我国铜下游消费结构.jpg	如果电力行业的铜消费量为230万吨，那么我国2021年铜总消费量为多少？	500万吨	460万吨	540万吨		A
pg	989	data/figure/pg/2023-03-23--专用设备-恒进感应-深耕感应热处理行业，热处理设备实现进口替代_page18_数控机床占比.jpg	根据图中的数控机床占比情况，数控金属切削机床的占比为多少？	53.80%	28.50%	16.80%		A
pg	990	data/figure/pg/2023-09-28--互联网服务-宇信科技-公司首次覆盖报告：银行IT领军，成长动能充足_page11_图132021年银行IT解决方案市场竞争格局分散.jpg	如果中电金信和宇信科技合并，它们的市场份额将达到多少？	13.95%	12.95%	14.95%		A
pg	991	data/figure/pg/2023-12-25--通用设备-中核科技-核岛阀门核心标的乘风而起，提质增效海外破局双管齐下_page24_图表35核岛阀门占核岛设备投资中的比例大概为12.jpg	根据饼图，核岛设备投资中哪一项所占比例最大？	压力容器	主管道	蒸汽发生器		A
pg	992	data/figure/pg/2022-11-29--装修建材-兔宝宝-渠道横纵并拓，模式优化升级，板材龙头稳健成长_page5_图42021年公司营收结构情况.jpg	如果装饰材料的市场份额减少10%，其新份额将是多少？	57%	63%	53%		A
pg	993	data/figure/pg/2023-08-10--通用设备-拾比佰-北交所个股研究系列报告：家电金属外观复合材料企业研究_page8_图表162019年全球家电彩涂板产量分布情况千吨.jpg	2019年全球家电彩涂板产量中，中国和韩国的产量总和占全球产量的多少百分比？	80%	76%	72%		A
pg	994	data/figure/pg/2023-02-27--酿酒行业-青岛啤酒-深度报告：打铁自身硬，一意战高端_page11_图19啤酒生产成本构成.jpg	图中哪两个成本项目的占比差距最大？	包装与制造费用	麦芽与直接人工	大米与能源		A
pg	995	data/figure/pg/2023-06-30--生物制品-百克生物-首款国产带疱疫苗放量可期_page10_图表192022年水痘疫苗批签发次数分布.jpg	根据图中的数据，百克生物的市场份额占比为多少？	27.85%	19.18%	11.42%		C
pg	996	data/figure/pg/2023-01-16--互联网服务-润泽科技-超大规模数据中心时代来临，以专业服务润泽数字经济_page13_图表18新BAT阿里字节腾讯在2021国内互联网服务器市场中占比超5成.jpg	在2021年国内互联网服务器市场中，New BAT的市场份额占比是多少？	超过50%	30%至40%	低于20%		A
pg	997	data/figure/pg/2022-12-22--工程建设-中国化学-深度报告之二：新能源材料的技术供应商_page43_图表2021年全国发电量结构.jpg	根据饼图，2021年全国发电量结构中，火力发电的占比是多少？	71%	55%	65%		A
pg	998	data/figure/pg/2024-02-20--化学原料-华鲁恒升-低成本筑壁垒，双基地促成长_page10_图92022年公司营业收入构成.jpg	如果将醋酸及衍生品和肥料业务合并，其市场份额将达到多少？	25%	30%	20%		A
pg	999	data/figure/pg/2023-04-30--汽车零部件-星源卓镁-汽车压铸件行业领跑，镁合金时代即将到来_page21_图35公司研发人员从事压铸行业年限情况.jpg	根据图中数据，从事压铸行业年限在9年及以下的研发人员占比为多少？	39.00%	61.00%	50.00%		A
pg	1000	data/figure/pg/2023-09-11--物流行业-密尔克卫-2023H1扣非后净利润同比下降19.14%，项目建设有序推进_page4_评级分布RatingDistribution.jpg	根据图中的评级分布，哪个季度的'优于大市'评级占比最高？	最新季度	上一季度	两个季度相同		C
pg	1001	data/figure/pg/2022-11-30--食品饮料-天味食品-渠道良性稳健发展，产品品牌具备持久动能_page7_图表5中国鸡精市场竞争格局.jpg	如果'太太乐'的市场份额减少10%，其占有率将变为多少？	40%	35%	45%		A
pg	1002	data/figure/pg/2023-06-18--装修建材-箭牌家居-公司深度研究：深耕陶瓷卫浴赛道，布局打造智慧家居品牌_page26_图40翻新业务规模不断扩大.jpg	从FY2001到FY2021，翻新业务的市场份额增加了多少百分点？	11%	21%	31%		B
pg	1003	data/figure/pg/2024-03-10--电子元件-广合科技-广合科技投资价值分析报告：服务器PCB龙头，携手优质客户快速成长_page20_no_caption.jpg	如果职工薪酬的占比增加5个百分点，新的占比是多少？	52.85%	50.85%	53.85%		A
pg	1004	data/figure/pg/2023-07-16--装修建材-永艺股份-办公椅龙头内外并进，全球产能布局领先_page8_图142022年中国办公椅主要出口公司市占率.jpg	如果永艺股份的市场份额为12%，恒林股份的市场份额为10%，那么其他公司的市场份额总和是多少？	78%	80%	68%		A
pg	1005	data/figure/pg/2023-09-28--中药-太极集团-半年报点评：工业营销高质增长，盈利能力持续提升_page5_评级分布RatingDistribution.jpg	根据饼图，最近一个完整季度的评级分布中，'Underperform'的比例是多少？	1.10%	9.20%	89.60%		A
pg	1006	data/figure/pg/2023-04-25--钢铁行业-广大特材-2022年报及2023年一季报点评：风电上游供应商，海风大年充分受益_page3_图72022年业务收入结构情况.jpg	如果新能源风电业务与能源装备业务合并，它们的市场份额将达到多少百分点？	64%	58%	62%		A
pg	1007	data/figure/pg/2022-12-23--电子化学品-鼎龙股份-公司首次覆盖报告：国内CMP材料龙头，平台化发展，前景可期_page12_图19抛光材料中抛光液和抛光垫占比较高.jpg	抛光液和抛光垫的市场份额之和占总市场的多少百分比？	82%	75%	60%		A
pg	1008	data/figure/pg/2023-06-01--电力行业-浙能电力-火电盈利修复弹性可期，参股核电支撑业绩_page8_图18公司煤电机组各类型占比截至2022年底.jpg	根据图中的煤电机组各类型占比，哪种类型的机组占比最高？	100万千瓦级及以上	60万千瓦级	30万千瓦级及以下		B
pg	1009	data/figure/pg/2023-02-15--铁路公路-海汽集团-拟收购海旅免税深度布局免税赛道，政策红利+资源整合实现全新突破_page8_图82021年海汽集团各业务营收占比.jpg	2021年海汽集团各业务中，占比最大的业务是什么？	汽车客运	客运站经营	汽车综合服务		A
pg	1010	data/figure/pg/2023-06-25--通用设备-祥鑫科技-公司深度报告：深耕冲压模具与结构件，多线布局加速兑现_page12_图262021年中国光伏逆变器市场竞争格局按出货量.jpg	根据图中的市场份额，哪个公司的市场份额最大？	阳光电源	锦浪科技	固德威		A
pg	1011	data/figure/pg/2023-09-17--医疗服务-阳光诺和-公司首次覆盖报告：立足仿制药CRO，自研新药转化加速业务转型_page14_图292023H1公司研发人员中本科及以上人才占比大.jpg	在公司研发人员中，占比最大的学历层次是什么？	本科	硕士	博士		A
pg	1012	data/figure/pg/2022-11-23--电池-鹏辉能源-公司首次覆盖报告：户储电池全球前二，大储电池放量在即_page14_图18德国户储市场由比亚迪主导.jpg	在德国户储市场中，哪个品牌的市场份额最大？	比亚迪	Senec	其他		A
pg	1013	data/figure/pg/2023-07-31--物流行业-永泰运-深度报告：千亿赛道消费升级，区域龙头扬帆奋楫_page22_图表292022年内贸危险品物流市场规模略大于外贸危险品物流市场规模单位亿元.jpg	根据图中数据，内贸危险品物流市场规模与外贸危险品物流市场规模相比如何？	内贸危险品物流市场规模略大于外贸危险品物流市场规模	内贸危险品物流市场规模远大于外贸危险品物流市场规模	内贸危险品物流市场规模小于外贸危险品物流市场规模		A
pg	1014	data/figure/pg/2022-12-19--通信设备-锐捷网络-企业网设备新贵，中小客户解决方案能力强_page27_图60云桌面市场行业分布单位.jpg	以下哪个行业在云桌面市场中的份额最大？	政务	教育	医疗		A
pg	1015	data/figure/pg/2023-01-29--专用设备-格力博-新股系列专题报告：格力博新股梳理_page19_no_caption.jpg	创科实业和博世的市场份额总和占整个市场的比重为多少？	30%	25%	20%		A
pg	1016	data/figure/pg/2023-09-13--软件开发-天融信-公司分析报告：两年增速位居行业前列，信创业务实现持续高增长_page3_图32023H1公司分产品收入结构.jpg	如果基础安全产品的收入为67亿元，公司总收入为多少？	100亿元	200亿元	300亿元		A
pg	1017	data/figure/pg/2023-08-21--环保行业-玉禾田-首次覆盖报告：“城市管家”的“数智化”升级_page18_图332021年我国物业行业从业人员各类别人数占比.jpg	根据图中的数据，保洁人员的占比是经理的多少倍？	24.0625倍	38.5倍	9.9倍		A
pg	1018	data/figure/pg/2022-12-08--医疗器械-华大智造-国产测序仪稀缺标的，广阔市场未来可期_page11_图152020年全球基因测序下游应用分布.jpg	如果学术研究的市场份额增长20%，其占有率将变为多少？	64.80%	72%	65%		A
pg	1019	data/figure/pg/2023-06-15--软件开发-中控技术-公司深度分析：2023年重点关注国际化、数字化、多元生态融合的落地_page9_图112021年国内DCS市场份额.jpg	根据图中的市场份额情况，哪个公司的市场份额最大？	中控技术	和利时	艾默生		A
