type	index	image	question	A	B	C	D	answer
lc	1	data/figure/lc/2024-07-03--联储证券-2024年中宏观展望：固本培元，如日之升_page8_图1215月固定资产投资主要由制造业拉动.jpg	在2023年5月至2024年5月期间，房地产开发投资同比增速在哪个月份最低？	23-Jul	23-Dec	24-May		C
lc	2	data/figure/lc/2024-06-24--光大期货-宏观周报：投资行业需求延续偏弱表现_page17_图表SCFI综合指数单位点.jpg	哪一年的SCFI综合指数波动最大？	2021年	2022年	2023年		B
lc	3	data/figure/lc/2024-07-09--国联证券-美国6月非农就业数据点评：失业率升破美联储6月预期_page16_图表33非农就业总人数单位百万人.jpg	哪一年非农就业人数首次超过疫情前水平？	2021	2022	2023		B
lc	4	data/figure/lc/2023-06-12--国金证券-海外周度观察：GDP和GDI的“背离”与“真相”-美国经济重现“技术性衰退”_page12_no_caption.jpg	2022年9月，哪个国家的航班飞行次数最高？	英国	意大利	法国		A
lc	5	data/figure/lc/2024-08-19--中航证券-2024年7月经济数据点评：内需修复进程是后续经济走势的关键_page7_图6固投及主要分项当月同比走势.jpg	在哪个时间段，基础设施建设投资同比增长率首次超过10%？	20-Apr	20-Jul	21-Jan		A
lc	6	data/figure/lc/2024-07-07--民生证券-高频数据跟踪周报：本周地产销售季节性回落_page9_图27CCFI综合指数续升点.jpg	图中2021年与2022年的交点在哪个月份？	6月1日	8月1日	10月1日		B
lc	7	data/figure/lc/2024-03-29--中银证券-1月美国国际资本流动报告点评：美联储宽松预期回撤，来美证券投资未能“开门红”_page5_no_caption.jpg	哪一年的波动幅度最大？	2022	2023	2024		A
lc	8	data/figure/lc/2023-08-17--光大期货-7月经济数据点评_page10_图表13房地产销售面积和销售金额当月同比单位.jpg	商品房销售金额在哪段时间内波动最为剧烈？	2021-06至2021-12	2022-01至2022-06	2022-07至2022-12		B
lc	9	data/figure/lc/2023-05-28--国联证券-全球货币体系的大变局：去美元化、债务困境和黄金石油的机会_page13_图表19外国持有美国国债的情况亿美元.jpg	哪一年外国持有美债的总量首次突破70000亿美元？	2015年	2017年	2019年		C
lc	10	data/figure/lc/2024-08-21--上海证券-2024年7月经济数据点评：增强经济回升向好态势_page3_图1三大行业工业增加值增速同比.jpg	采矿业增加值增速在哪一年出现了显著下降？	2016	2018	2020		C
lc	11	data/figure/lc/2023-07-10--东吴证券-宏观周报：货币政策刺激效果缘何“钝化”？_page13_图25磨机运转率同样小幅上行.jpg	根据图表，哪一年的磨机运转率波动最大？	2019年	2020年	2021年		B
lc	12	data/figure/lc/2024-04-17--天风证券-宏观：经济数据缘何超预期_page2_no_caption.jpg	在哪个时间段，制造业拉动的增长率首次超过房地产开发投资拉动？	2021-02至2021-08	2022-02至2022-08	2023-02至2023-08		B
lc	13	data/figure/lc/2023-04-19--万联证券-3月经济数据点评：经济仍处复苏前期，消费支撑作用加强_page7_图表18居民可支配收入持续修复.jpg	图中哪一年居民人均可支配收入累计名义同比最高？	2021年	2022年	2023年		A
lc	14	data/figure/lc/2024-03-27--信达证券-能耗目标：政策梳理和影响测算_page20_图20我国焦炭钢材出口量.jpg	钢材出口量在哪一年达到峰值？	2016	2018	2020		A
lc	15	data/figure/lc/2023-06-12--国金证券-海外周度观察：GDP和GDI的“背离”与“真相”-美国经济重现“技术性衰退”_page8_图表19基于GDP的衰退预测模型.jpg	在哪个时间段，GDP衰退概率达到最高点？	1959-1960	2008-2009	2020-2021		C
lc	16	data/figure/lc/2024-02-22--中国银河-宏观专题报告：美国库存回升，中国出口转正_page0_图出口是工业企业利润的决定性因素.jpg	在哪个年份，出口年度同比增速达到最低点？	2009	2016	2020		A
lc	17	data/figure/lc/2024-05-22--国金证券-见微知著系列之七十六：工业品涨价的“复苏”逻辑_page6_图表112024年PTA价格指数维持高位.jpg	观察图表，哪一年的南华PTA价格指数波动最大？	2020	2021	2022		A
lc	18	data/figure/lc/2023-04-10--平安证券-美国3月非农就业数据解读：美联储会停止加息么？_page3_图表74月7日美债收益率上升.jpg	2023年2月至3月，2年美债利率的变化趋势是？	上升	下降	先升后降		A
lc	19	data/figure/lc/2024-05-30--大同证券-4月份工业企业利润数据解读：经济温差或侵蚀盈利，补库开启仍需观察_page1_图表24月份出口增速明显回升.jpg	哪一年出口金额当月同比达到最高点？	24-Jan	24-Feb	24-Mar		B
lc	20	data/figure/lc/2024-01-05--国海证券-2024年十大关键词_page4_图表海外经济疲弱我国出口或承压.jpg	美国制造业PMI在哪一年达到最高点？	2020	2021	2022		B
lc	21	data/figure/lc/2024-07-08--国泰期货-海外宏观及大类资产周度报告_page19_中国央行黄金与外汇储备.jpg	外汇持有量在哪个年份达到最低点？	2016	2018	2020		A
lc	22	data/figure/lc/2024-07-07--民生证券-高频数据跟踪周报：本周地产销售季节性回落_page10_图29CICFI综合指数下降点.jpg	图中2021年至2022年CICFI综合指数的变化趋势是？	持续上升	先升后降	持续下降		B
lc	23	data/figure/lc/2024-02-25--东吴证券-国内宏观经济周报：春节后国内经济“首秀”表现如何？_page14_图28农产品价格节后回落.jpg	哪一年的农产品批发价格指数在春节后（02-10）达到最高值？	2020	2021	2022		B
lc	24	data/figure/lc/2023-11-26--东海证券-宏观周报：地产销售恢复偏缓，风险化解力度加大_page7_图8美元兑人民币汇率与美元指数.jpg	观察图表，哪个时间段的美元指数达到最高点？	23-Sep	23-Oct	23-Nov		B
lc	25	data/figure/lc/2023-05-16--东吴证券-宏观点评：4月经济：高基数“掩盖”了什么真相？_page4_no_caption.jpg	2022年8月，哪个行业的同比增长率最低？	电、热、水供应	交通仓储	水利、环境和公共设施		B
lc	26	data/figure/lc/2024-07-15--中泰证券-全球7月宏观跟踪：美联储降息预期升温，全球制造业景气微降_page21_图表20122024年美国核心CPI与核心PCE数据.jpg	图中显示，美国核心CPI在哪一年开始显著上升？	2020	2021	2022		B
lc	27	data/figure/lc/2024-03-24--民生证券-流动性跟踪周报：R007上行至2.08%_page10_图12不同银行CD发行成功率.jpg	2024年2月，哪种银行的CD发行成功率最低？	城商行	股份行	农商行		A
lc	28	data/figure/lc/2024-07-11--万联证券-6月通胀数据点评：CPI延续低位，需求有待修复_page4_图表9CPI燃料相关分项走势.jpg	哪个年份OPEC一揽子石油价格达到最高点？	2021	2022	2023		B
lc	29	data/figure/lc/2022-10-28--山西证券-9月工业企业利润数据点评与A股行业盈利展望：利润增速承压，中下游持续改善_page8_图22钢铁9月利润增速或持续下行.jpg	钢铁行业在哪个时间段归母净利润同比增速持续为负？	2014-2015	2018-2019	2020-2021		A
lc	30	data/figure/lc/2023-10-13--国联证券-美国9月CPI数据点评：通胀数据略超预期，美联储或继续鹰派姿态_page4_图表7核becauseGP未来情景.jpg	哪条线在2023年12月达到最高点？	环比0.4%	环比0.3%	环比0.2%		A
lc	31	data/figure/lc/2023-12-03--信达证券-2024年财政政策展望：结构、力度和工具_page9_图8地产行情变差导致土地财政退潮.jpg	房地产开发投资完成额累计同比在2021年的最高点出现在哪个季度？	第一季度	第二季度	第三季度		B
lc	32	data/figure/lc/2023-12-17--中国银河-2024年中国经济展望：《变局·重构》_page11_图16日本危机期间的财政政策过于保守.jpg	在哪个年份，企业部门杠杆率达到最高点？	1993	1995	1997		A
lc	33	data/figure/lc/2024-04-07--粤开证券-【粤开宏观】我国就业市场全景图谱与三大重点就业人群分析_page10_图表1020182022届本科毕业生未就业比例变化趋势.jpg	2020年其他待就业的比例是多少？	5.20%	5.50%	6.00%		A
lc	34	data/figure/lc/2024-02-25--东吴证券-国内宏观经济周报：春节后国内经济“首秀”表现如何？_page13_图23沥青库存继续上行.jpg	在2021年和2022年中，哪一年的沥青库存增长速度更快？	2021年	2022年	两者相同		B
lc	35	data/figure/lc/2024-07-12--民生证券-2024年6月外贸数据点评：三条线索，出口还能强多久？_page2_图3中国出口价格显著低于全球.jpg	根据图表，哪一年中国出口价格与全球出口价格差距最大？	2008	2014	2021		A
lc	36	data/figure/lc/2023-07-31--中邮证券-宏观研究：装备制造业盈利占优，消费需求温和复苏_page7_图表13PTA开工率.jpg	哪一年的PTA开工率波动最大？	2021	2022	2023		B
lc	37	data/figure/lc/2024-02-25--东吴证券-国内宏观经济周报：春节后国内经济“首秀”表现如何？_page12_图20螺纹钢库存加速上行.jpg	2021年螺纹钢库存的最高点出现在哪个月份？	2月	3月	1月		A
lc	38	data/figure/lc/2023-07-17--国信证券-宏观经济宏观周报：7月上旬国内生产资料价格继续上涨，PPI环比或转正_page0_市场走势.jpg	工业增加值月度同比增速在哪一年出现了显著下降？	2022年	2023年	2024年		B
lc	39	data/figure/lc/2024-07-29--平安证券-中国经济高频观察（7月第4周）：7月高频数据表现如何_page5_图表207月涤纶长丝江浙织机开工回落同比涨幅收窄.jpg	在2023年，开工率最高点出现在哪个月份？	4月	6月	8月		A
lc	40	data/figure/lc/2023-11-22--招银国际-2024年美国经济展望：在软着陆与温和衰退之间_page16_图50欧元美元汇率与利差.jpg	在哪个时间段，资本充足率出现了显著上升？	2009-2010	2015-2016	2020-2021		C
lc	41	data/figure/lc/2024-07-18--上海证券-2024年6月经济数据点评：消费走弱，经济仍需巩固_page4_图3固定投资完成额增速累计同比.jpg	根据图表，第三产业在哪一年达到了最低点？	23-Jun	23-Oct	24-Feb		B
lc	42	data/figure/lc/2023-07-04--国投安信期货-5月美国PCE数据快报_page0_图美国个人总收入及薪金工资同比.jpg	在哪一年，PCE:非耐用品的同比增速达到最低点？	22-Sep	22-Oct	22-Nov		B
lc	43	data/figure/lc/2024-04-07--国金证券-清明特辑：假期大事记-3分钟看清清明全球要闻_page17_图表543月外需带动新订单指数走强.jpg	哪一年的新订单指数波动最大？	2022	2023	2024		A
lc	44	data/figure/lc/2023-07-31--中泰证券-高频数据观察：大宗商品价格上行_page6_图表16出口集装箱运价指数.jpg	CCFI综合指数在2022年的平均值最接近哪个数值？	3000	3500	4000		B
lc	45	data/figure/lc/2023-11-02--国联证券-高频数据跟踪（2023年10月第4周）：需求表现分化，基建施工景气略有改善_page15_no_caption.jpg	哪一年的PTA价格整体最低？	2019	2020	2023		B
lc	46	data/figure/lc/2024-06-24--光大期货-宏观周报：投资行业需求延续偏弱表现_page18_no_caption.jpg	2024年哪个月份的指数最高？	1月	2月	3月		A
lc	47	data/figure/lc/2023-08-28--天风证券-宏观点评：出口仍然是今年经济的亮点_page6_图12美联储估算美国自中国进口金额被明显低估单位十亿美元.jpg	哪一年中国对美国的出口额首次超过450亿美元？	2017	2018	2019		B
lc	48	data/figure/lc/2024-07-08--国泰期货-海外宏观及大类资产周度报告_page19_中国进出口同比.jpg	哪个时间段的中国贸易进口总额同比波动最为剧烈？	2019/5 - 2019/8	2020/11 - 2021/5	2023/5 - 2024/5		B
lc	49	data/figure/lc/2024-07-04--上海证券-海外市场跟踪：美国PCE下降，通胀仍显韧性_page3_图6美国国债收益率以及利差BP.jpg	2023年美国2年期国债收益率最高点出现在哪个月？	2023/3/1	2023/6/1	2023/9/1		A
lc	50	data/figure/lc/2023-04-19--华安期货-宏观分析报告：主要经济指标向好，市场风险偏好继续改善_page3_图表8CPI食品和非食品分项.jpg	哪个时间段的CPI和PPI剪刀差最大？	2020-03至2020-06	2021-09至2021-12	2022-06至2022-09		B
lc	51	data/figure/lc/2023-11-24--开源证券-宏观深度报告：2024年宏观经济展望-破浪前行_page6_图4美国服务消费保持坚挺.jpg	哪一年美国个人消费支出服务环比下降幅度最大？	2020	2021	2022		A
lc	52	data/figure/lc/2024-02-26--国金证券-海外周度观察：“廉价的”日本！_page15_图表46美国2月12日当周新增职位数量下降.jpg	2022年5月至2024年2月，哪个行业的活跃职位数量波动最大？	制造业	餐饮服务	专业服务		C
lc	53	data/figure/lc/2023-05-08--招商银行-2023年4月宏观经济月报：海外衰退渐近，国内复苏分化_page8_服务业生产明显修复.jpg	图中2021年的最高点是多少？	30	35	40		A
lc	54	data/figure/lc/2023-04-20--上海证券-“春风吹拂，科创掘金”专题报告（一）：拥抱人工智能浪潮，TMT中长主线共识持续_page8_图16近5年通信行业市盈率TTM.jpg	在2018年4月至2023年4月期间，pe_ttm最低点出现在哪一年？	2019年4月	2022年4月	2023年4月		B
lc	55	data/figure/lc/2022-12-26--平安证券-国内宏观周报：央行重启14天逆回购_page9_no_caption.jpg	在岸美元兑人民币汇率在哪段时间内下降最多？	2022/06-2022/08	2022/08-2022/10	2022/10-2022/12		C
lc	56	data/figure/lc/2023-10-31--海通国际-海外经济政策跟踪：美国库存如何了？_page3_图3制造商零售商与批发商库存百万美元.jpg	图中制造商库存在哪一年达到峰值？	21-Aug	22-Aug	23-Aug		B
lc	57	data/figure/lc/2023-05-22--国金证券-见微知著系列之五十二：用电变化，透露的经济线索？_page10_no_caption.jpg	2022年全国247家钢厂盈利率在哪个月达到最高点？	1月	2月	3月		A
lc	58	data/figure/lc/2023-06-25--国金证券-海外周度观察：日本走出通缩阴影了吗？_page11_图表33美国各行业活跃职位数量降低.jpg	哪个行业的职位发布数量在2022年4月至2023年6月期间波动最大？	教育	医疗	专业服务		A
lc	59	data/figure/lc/2024-05-09--国金证券-2024年4月经济数据前瞻：4月经济前瞻：“量增”强于“价涨”_page13_图表424月CPI同比或维持低位.jpg	2021年至2022年期间，CPI同比最高点出现在哪一年？	2021	2022	两者相同		B
lc	60	data/figure/lc/2023-07-06--东兴证券-2023年年中海外经济展望：衰退延迟_page5_图10实际人均可支配收入同比提高.jpg	在哪个时间段，美国个人可支配收入出现了显著下降？	2012-2013	2018-2019	2020-2021		C
lc	61	data/figure/lc/2023-11-28--国金证券-见微知著系列之六十二：房地产研究“新范式”_page14_图表49本周代表城市二手房成交有所回落.jpg	2022年全国二手房成交面积最低点出现在哪个月？	2月	3月	1月		A
lc	62	data/figure/lc/2024-10-10--麦高证券-宏观研究月报：谋定而后动，经济稳增长可期_page8_图表6固定资产投资完成额累计同比增速.jpg	哪一类投资在2022年的累计同比增速最低？	基础设施建设投资	制造业投资	房地产开发投资		C
lc	63	data/figure/lc/2023-07-20--天风证券-宏观：二季度经济数据中的亮点_page5_图8基建投资的分化单位累计同比.jpg	2022年6月，哪种投资的累计同比增速最低？	基础设施投资（不含电力）	基础设施建设投资	电力、热力、燃气及水生产和供应业		A
lc	64	data/figure/lc/2024-07-09--国联证券-美国6月非农就业数据点评：失业率升破美联储6月预期_page6_图表9Sahm法则.jpg	图中Sahm rule在2020年的峰值是多少？	9.5	8.5	7.5		A
lc	65	data/figure/lc/2023-09-07--平安证券-2023年9月宏观利率策略：政策的边际影响探讨_page16_14年底销售面积见底15年年中销量较14年末增长5万平米.jpg	哪一年商品房销售面积的累计值达到最高点？	2021年	2019年	2023年		A
lc	66	data/figure/lc/2024-07-02--格林期货-宏观经济专题报告：PMI连续两个月略低于荣枯线_page4_图4制造业PMI出厂价格指数主要原材料购进价格指数和PPI环比.jpg	2022年第二季度PPI环比最低点出现在哪个季度？	22-Q1	22-Q2	22-Q3		B
lc	67	data/figure/lc/2023-09-15--中国银河-2023年8月经济数据分析：政策释放下经济平稳回升，房地产仍未止跌_page8_图20本地户籍失业率反弹外来与农业户籍失业率继续下降.jpg	外来农业户籍人口失业率在哪一年达到最低点？	2021年	2022年	2023年		C
lc	68	data/figure/lc/2023-06-24--国金证券-见微知著系列之五十五：基建落地“新”变化？_page14_图表54全国新房成交水平显著低于过往.jpg	图中2023年哪个月份的成交面积最低？	1月	2月	3月		B
lc	69	data/figure/lc/2024-04-16--中银证券-3月和一季度经济数据点评：稳增长成绩来之不易_page2_图表5工业增加值同比增速.jpg	工业增加值当月同比增速在哪一年出现了明显的峰值？	2021	2022	2024		C
lc	70	data/figure/lc/2024-01-25--海通国际-全球能源转型：越南新能源深度探究；越南绿色革命的机遇_page22_no_caption.jpg	2022年与2023年相比，哪个年份的库存水平在10月份更高？	2022	2023	相同		B
lc	71	data/figure/lc/2023-06-27--西南证券-宏观周报：原材料价格周环比回升，地产假期销售改善_page2_图86月乘用车日均销量同比下降.jpg	图中哪一年的乘用车日均销量波动最大？	2019	2020	2021		B
lc	72	data/figure/lc/2023-10-16--开源证券-9月通胀数据点评：大宗商品涨价驱动PPI环比回升_page5_图8PPI重点工业品价格涨多跌少.jpg	图中煤炭开采和洗选业在哪个时间段内波动最大？	2021-09至2022-03	2022-05至2022-09	2023-01至2023-05		A
lc	73	data/figure/lc/2024-02-27--华安证券-大类资产配置月报第32期：2024年3月：政策博弈加剧，关注“两会”与美联储降息时点_page27_新开工下行降幅逐步收窄.jpg	图中螺纹钢活跃合约收盘价月均值在哪一年达到峰值？	2020	2021	2022		B
lc	74	data/figure/lc/2024-03-25--国金证券-“美国大选”系列之五：特朗普2.0：政策组合，有何不同？_page14_图表41美国3月11日当周新增职位数量上升.jpg	哪一年专业服务行业的活跃职位数量达到峰值？	22-Dec	23-Mar	24-Mar		B
lc	75	data/figure/lc/2024-09-03--山西证券-海外经济周观察_page4_图624Q2实际个人消费支出环比折年率上升.jpg	根据图表，哪个季度的实际个人消费环比折年率最低？	2022年3月	2022年6月	2022年9月		A
lc	76	data/figure/lc/2024-03-20--交银国际证券-中国宏观：设备更新与循环经济带来的投资机会_page7_图表5中国科研费用占GDP比重仍有提升空间.jpg	从1996年到2020年，哪个国家的科研费用占GDP比重增长最快？	韩国	日本	欧盟		A
lc	77	data/figure/lc/2023-04-04--华泰期货-宏观大类日报：海外通胀预期再起_page2_图2全国城市二手房出售挂牌价指数丨单位.jpg	三线城市二手房挂牌价指数在2022年10月至2023年1月期间的变化趋势是？	持续上升	先下降后上升	持续下降		B
lc	78	data/figure/lc/2023-07-18--东海证券-国内观察：2023年6月经济数据：恢复仍偏弱，结构有亮点_page8_图15制造业投资累计同比.jpg	哪一年全部制造业累计同比增速达到最低点？	20-Mar	20-Jun	20-Sep		A
lc	79	data/figure/lc/2024-08-13--国信证券-宏观经济专题研究：若美降息周期开启，谁受益？谁受损？_page4_图4纳斯达克暴跌后美联储仍在大幅加息.jpg	图中2000年3月10日纳斯达克指数的最高点是多少？	5049	5200	5500		A
lc	80	data/figure/lc/2023-10-16--开源证券-9月通胀数据点评：大宗商品涨价驱动PPI环比回升_page5_图72022年基数回落PPI同比回升.jpg	在2022年，PPI生产资料同比在哪一季度开始下降？	第一季度	第二季度	第三季度		B
lc	81	data/figure/lc/2023-08-22--国金证券-“重估中国”系列报告：1990年代末的转型，对当下有何启示？_page10_图表38农村居民消费支出修复慢于城镇居民.jpg	哪一年农村居民人均消费支出增速达到最高点？	1994	1995	1996		A
lc	82	data/figure/lc/2024-02-26--中国银河-中央财经委第四次会议解读：新一轮朱格拉周期的可能性_page2_图2金融机构加权平均利率保持下行趋势.jpg	图中显示，哪一年金融机构人民币贷款加权平均利率:一般贷款达到最低点？	2021	2022	2023		C
lc	83	data/figure/lc/2024-02-29--国信证券-宏观经济专题研究：复盘中国汽车产业史_page4_图2建国初期公路里程较低.jpg	中国公路里程在哪一年开始显著增长？	1990	2000	2010		B
lc	84	data/figure/lc/2023-10-25--华泰期货-财政增发1万亿国债点评：资产端扩张的信号开启_page4_图5央行资产负债表结构丨单位YOY.jpg	哪个时间段的国外资产波动最为剧烈？	2020-2021	2021-2022	2022-2023		C
lc	85	data/figure/lc/2024-02-19--中邮证券-高频数据跟踪：节中出行娱乐消费热度高_page3_图表1假期当周焦炉开工率小幅回升.jpg	在2022年7月至2022年9月期间，焦炉生产率的最低点出现在哪个月份？	2022年7月	2022年8月	2022年9月		B
lc	86	data/figure/lc/2024-02-18--国联证券-宏观专题研究：春节期间国内外宏观数据有积极信号_page5_图表5一线城市地铁客运量.jpg	哪个年份的波动幅度最大？	2020	2021	2022		A
lc	87	data/figure/lc/2023-11-24--中国银河-宏观研究：内外因助推人民币快速拉升_page2_图6美国国债收益率.jpg	在2022年期间，哪个时间段的10年期国债到期收益率增长最快？	2022-01至2022-03	2022-04至2022-06	2022-07至2022-09		C
lc	88	data/figure/lc/2023-11-22--招银国际-2024年美国经济展望：在软着陆与温和衰退之间_page11_图31通胀预期与企业库存环比增速.jpg	观察图表，哪个年份的库存环比增速达到峰值？	2010	2013	2022		C
lc	89	data/figure/lc/2024-01-11--中银证券-2024年宏观经济与大类资产配置展望：复苏起点_page43_图表105货币基金收益率中位数.jpg	2023年7月，哪个指标的收益率最低？	商业银行NCD收益率: 2个月	R007	货基收益率中位数		C
lc	90	data/figure/lc/2024-05-09--国金证券-2024年4月经济数据前瞻：4月经济前瞻：“量增”强于“价涨”_page15_图表48上周钢厂盈利率延续回弹.jpg	哪一年的全国247家钢厂盈利率波动幅度最大？	2020	2021	2022		C
lc	91	data/figure/lc/2023-08-14--东莞证券-7月金融数据点评：社融增量超预期回落，信贷融资大幅度走弱_page1_图4M1M2同比.jpg	在哪一年，M1的增长率首次降至负数？	2022	2023	2024		A
lc	92	data/figure/lc/2023-11-02--中泰证券-2023年10月PMI数据解读：理性看待官方PMI回落_page3_图表1制造业建筑业与服务业PMI走势.jpg	建筑业PMI在哪个时间段出现显著下降？	2021年6月-2021年11月	2022年4月-2022年9月	2023年2月-2023年7月		B
lc	93	data/figure/lc/2023-04-10--中信期货-基建实物工作量高频数据跟踪_page5_镀锌管成交量与水利投资有较强相关性.jpg	哪一年的水利投资当月同比增速最高？	2021	2022	2023		B
lc	94	data/figure/lc/2023-04-20--华泰期货-经济高频数据追踪_page43_no_caption.jpg	哪一年的5月数值最低？	2021	2022	2023		B
lc	95	data/figure/lc/2024-01-11--国金证券-“宏观基本面”系列：温和通胀的微观基础？_page9_图表24居民可支配收入处于修复通道.jpg	根据图表，哪一年城镇居民消费性支出增速达到最低点？	2019年	2020年	2021年		B
lc	96	data/figure/lc/2024-01-17--粤开证券-【粤开宏观】2023年中国经济复盘及2024年展望_page7_图表7股市表现与通胀水平存在一定的正相关.jpg	万得全A指数在哪一年出现了显著下降？	2018	2020	2022		A
lc	97	data/figure/lc/2024-08-04--开源证券-宏观周报：二手房成交有所回落_page6_图12最近两周铜铝价格延续回落.jpg	铝价在哪个时间段达到最高点？	24-May	24-Jun	24-Jul		B
lc	98	data/figure/lc/2023-12-04--中国银河-热点与高频：部分经济数据可能短期回落_page3_图2离岸人民币与美元指数.jpg	美元指数在哪一年达到最高点？	2020	2022	2023		B
lc	99	data/figure/lc/2023-11-22--招银国际-2024年美国经济展望：在软着陆与温和衰退之间_page16_图512024年美欧经济增速差将明显缩小.jpg	在哪个时间段，美元指数出现了明显的峰值？	1984-1985	1998-1999	2008-2009		A
lc	100	data/figure/lc/2023-04-03--平安证券-国内宏观周报：地产高频指标显著改善_page5_图表22上周百城土地成交面积环比增加83.jpg	图中哪一年的土地成交面积在年初达到峰值？	2020	2021	2023		C
lc	101	data/figure/lc/2024-03-25--平安证券-中国经济高频观察（3月第3周）：投资带动上游高频指标改善_page6_图表23本周汽车轮胎半钢胎开工率续创15年以来新高.jpg	哪一年的汽车轮胎半钢胎开工率在年初出现了显著下降？	2020	2021	2022		A
lc	102	data/figure/lc/2023-05-15--华鑫证券-美国风险面面观：居民、企业、金融市场和主权信用_page20_图表25当前美国已经有三家银行破产破产规模超过2008年.jpg	银行破产规模在哪个年份首次超过300,000百万美元？	2007年	2009年	2011年		B
