type	index	image	question	A	B	C	D	answer
hg	494	data/figure/hg/2023-12-01--国金证券-2024年宏观经济形势展望：江春入旧年_page7_图表12美国CMBS逾期率.jpg	从图表中可以看出，总体CMBS逾期率在哪个时间段内最低？	22-Oct	23-Apr	23-Aug		A
hg	495	data/figure/hg/2024-09-13--国联证券-美国大选观察（三）：总统辩论中哈里斯的表现更好_page7_图表4民调显示更多人认为拜登输了第一次辩论.jpg	根据图表，特朗普的占比大约是多少？ 	30%	50%	70%		C
hg	496	data/figure/hg/2024-05-17--中银证券-4月经济数据点评：生产强于内需的格局延续_page3_图表102024年4月各品类社零累计同比增速.jpg	哪类商品的零售额增速最快？	通讯器材类	粮油、食品类	饮料类		A
hg	497	data/figure/hg/2023-04-10--平安证券-美国3月非农就业数据解读：美联储会停止加息么？_page1_图表2大部分行业新增就业边际放缓.jpg	2023年3月与2月相比，零售业的新增就业人数变化如何？	增加	减少	不变		B
hg	498	data/figure/hg/2023-02-12--开源证券-宏观经济点评：当下宽信用关键点在居民端_page3_图11月信贷超预期多增居民企业分化明显.jpg	近五年均值中，哪一年的企业贷款最高？	23-Jan	22-Jan	21-Jan		A
hg	499	data/figure/hg/2022-11-03--中泰证券-9月宏观月报：国内持续修复，海外衰退迫近_page23_图表43对主要经济体出口金额同比增速.jpg	2022年9月对欧盟的出口金额同比增速是多少？	5	10	0		A
hg	500	data/figure/hg/2023-06-02--紫金天风-云南水电专题二：终极问题——复产的可能性_page10_图7云南水电预测实际年度对比图.jpg	2022年水电发电实际值与预测值相比，哪个更高？	实际值	预测值	两者相同		B
hg	501	data/figure/hg/2022-12-18--粤开证券-【粤开宏观】从财税视角看内蒙古：北部边疆的突围之路_page14_图表182021年内蒙古自治区12地市一般公共预算收入质量.jpg	哪个城市的税收收入占比最低？	兴安盟	锡林郭勒盟	呼伦贝尔市		A
hg	502	data/figure/hg/2023-10-22--民生证券-全球大类资产跟踪周报：避险情绪蔓延_page6_图12主要经济体10年期国债收益率变动幅度.jpg	哪个国家的10年期国债收益率变动幅度最小？	中国	西班牙	意大利		A
hg	503	data/figure/hg/2024-05-08--国金证券-大类资产月报第12期：5月展望：“拐点”已现？_page15_图表46本月新兴市场10年期国债收益率全线上行.jpg	哪个国家的国债收益率最低？	泰国	越南	印度		B
hg	504	data/figure/hg/2024-04-18--太平洋-3月金融数据点评：信贷投放均衡化，融资需求释放有限_page7_企业新增人民币贷款累计.jpg	2024年企业新增人民币贷款累计金额最高的年份是？	2018	2023	2024		B
hg	505	data/figure/hg/2024-09-13--国联证券-美国大选观察（三）：总统辩论中哈里斯的表现更好_page7_图表5民调显示更多人认为哈里斯赢了辩论.jpg	根据图表，哪位候选人的支持率更高？	哈里斯	特朗普	数据不明确		A
hg	506	data/figure/hg/2023-06-27--中诚信国际-宏观经济与大类资产配置月报（2023年5月）：需求不足拖累经济修复，资产配置仍建议股债均衡_page8_图13八大类构成.jpg	哪一类在2023年5月的百分比最高？	其他用品和服务	医疗保健	居住		A
hg	507	data/figure/hg/2022-12-27--民生证券-海外疫情系列研究（三）：疫情冲击波：达峰时间及后续影响_page9_图8各地区在感染高峰中的零售冲击单位.jpg	在第二轮冲击中，哪个地区的零售冲击最大？	中国台湾	韩国	美国		A
hg	508	data/figure/hg/2023-02-15--粤开证券-【粤开宏观】从财税视角看吉林：“白山黑土”的转型之困不财政之难_page26_图表422021年吉林省代表区县地方政府负债率.jpg	负债率最低的区是？	朝阳区	南关区	宽城区		A
hg	509	data/figure/hg/2024-08-09--天风证券-宏观：加关税与抢出口_page1_图2分国别对7月出口的拉动单位.jpg	哪国在2024年6月对7月出口的拉动单位最大？	东盟	美国	欧盟		A
hg	510	data/figure/hg/2023-06-14--平安证券-2023下半年宏观经济展望：产能周期下的嬗变_page50_no_caption.jpg	居民中长期贷款的增量与去年同期相比是增加了还是减少了？	增加了	减少了	没有变化		B
hg	511	data/figure/hg/2023-12-28--国金证券-2023年11月工业企业利润点评：利润率大幅反弹_page4_图表1111月国有企业利润大幅改善.jpg	2023年 11月工业企业利润中，哪类企业的利润率同比增幅最小？	国有企业	外商企业	私营企业		B
hg	512	data/figure/hg/2023-07-06--国金证券-大类资产周报第4期：“低库存”下的投资机遇？_page3_no_caption.jpg	6月以来表现最好的大宗商品类别是？	黑色	农产品	能化		A
hg	513	data/figure/hg/2023-09-22--粤开证券-【粤开宏观】专项债全面回顾：结构特征、利弊分析与应对_page9_图表82022年31省份专项偿债率对比.jpg	2022年专项偿债率最高的省份是哪个？	天津	黑龙江	云南		A
hg	514	data/figure/hg/2023-06-20--国金证券-政策半月谈系列十：促消费，有哪些抓手？_page5_图表132022年汽车购置税减免600亿元.jpg	2016年的汽车购置税减免额大约是多少亿元？	750	800	600		A
hg	515	data/figure/hg/2023-02-15--粤开证券-【粤开宏观】从财税视角看吉林：“白山黑土”的转型之困不财政之难_page17_图表232021年31省份一般公共预算支出规模.jpg	2021年一般公共预算支出最高的省份是哪个？	广东	江苏	山东		A
hg	516	data/figure/hg/2024-01-23--投中信息-投中统计：2023年中国并购市场统计分析报告_page17_no_caption.jpg	哪一行业在2023年中国并购市场中占据最大份额？	公用事业	金融	传统制造		A
hg	517	data/figure/hg/2023-05-08--国金证券-大类资产月报第1期：5月卖出法则，还适用吗？_page14_图表38美联储加息预期再度升温.jpg	根据直方图，业绩超预期的公司数量在哪个时间段达到峰值？	04-26至04-28	04-18至04-20	04-04至04-06		A
hg	518	data/figure/hg/2023-04-07--中国银河-大类资产与金融市场监测周报2023年4月第一周：美加息预期再降温，马克龙一行访华_page5_no_caption.jpg	根据直方图，哪个行业在中国WIND行业中表现最好？	电信服务	信息技术	金融		A
hg	519	data/figure/hg/2024-05-15--粤开证券-【粤开宏观】城投公司转型的可能方向与风险—城投转型系列之三_page9_图表2截至2022年底各业务类型城投公司公益性和准公益性业务收入占比均值.jpg	哪类业务类型城投公司公益性和准公益性收入占比最高？	棚改/保障房建设	基础设施建设	土地开发整理		A
hg	520	data/figure/hg/2022-11-24--信达证券-信达宏观方法论之十一：CPI的深度拆解与预测逻辑_page19_图20中国印度为首的新兴国家构成原油增量需求.jpg	2018年原油消费增量最高的国家是？	中国	印度	美国		C
hg	521	data/figure/hg/2023-06-04--华金证券-2023年中全球宏观经济金融展望：山止川行_page37_图64A股主要行业2020年以来分阶段涨跌幅对比.jpg	2020-2022年涨幅最大的行业是哪个？	电力设备	食品饮料	基础化工		A
hg	522	data/figure/hg/2023-08-05--中国银河-8月4日四部委联合发布会点评：逆周期调节加码，高质量发展升级_page20_图342023年47月交通运输细分行业多数下跌.jpg	2023年4-7月物流行业的涨跌幅是多少？	-8%	-6%	-4%		A
hg	523	data/figure/hg/2023-11-24--开源证券-宏观深度报告：2024年宏观经济展望-破浪前行_page49_no_caption.jpg	根据直方图，哪个行业的2015-2017年同比均值最高？	黑色冶炼压延	煤炭采选	有色金属采选		A
hg	524	data/figure/hg/2024-01-14--国联证券-海外宏观周专题：美国经济有哪些可能长大的丑小鸭？_page24_图表39100未投保存款人挤兑风险比率分布.jpg	在2022年第一季度，未投保存款人的挤兑风险比率的中位数是多少？	18.40%	3.90%	2.70%		A
hg	525	data/figure/hg/2023-11-22--首创证券-10月经济数据点评：10月经济延续弱修复_page7_图1310月9月零售分项四年平均同比.jpg	根据直方图，零售额增长最快的品类是哪个？	石油及制品	化妆品类	汽车		A
hg	526	data/figure/hg/2023-08-03--腾景数研-腾景宏观月报：基于腾景国民经济运行全口径数据-2023年6月全口径消费：消费增速边际回落，内生动能仍待提振_page6_图42023年5月6月政府消费不变价同比.jpg	2023年6月，哪一项的政府消费同比变化为负值？	医疗卫生与计划生育	文化体育与传媒	科学技术		C
hg	527	data/figure/hg/2023-12-19--国泰期货-2024年海外宏观经济展望：先下行风险，后周期机遇，寻均衡利率_page26_图90就业数据对10年期美债影响最为显著.jpg	根据直方图，哪一项对10年期美债收益率的影响最大？	Payrolls Change (Thousands)	Retail Sales Advance (MoM %)	ISM Manufacturing (SA)		A
hg	528	data/figure/hg/2023-03-10--国投安信期货-2月物价数据快报_page0_图CPI食品类环比.jpg	2023年2月猪肉的价格环比变化是多少？	-11.4	-4.4	-1.5		A
frg	529	data/figure/frg/2023-06-21--汽车零部件-岱美股份-遮阳板全球龙头，二次成长曲线拉开帷幕_page4_图表1公司发展历程.jpg	2008年，上海岱美汽车内饰件有限公司完成了股份改制，这是否意味着公司已经实现了完全的股权分散？	是	否	不确定		B
frg	530	data/figure/frg/2023-08-04--软件开发-国子软件-北交所新股申购报告：资产管理数字化服务商，专注行政及教育领域_page3_图2韩承志为公司控股股东及实际控制人合计控制公司9135股份的表决权.jpg	国子软件的控股股东是谁？	韩承志	庞瑞英	其他31名员工		A
frg	531	data/figure/frg/2023-09-14--美容护理-润本股份-“庖丁解牛”拆析招股书（十九）润本股份：驱蚊赛道国货龙头，婴童护理业务未来可期_page28_图表公司营销相关事件.jpg	2019年润本股份在小红书上的营销活动主要目的是什么？	吸引平台用户	分享育儿知识	发布优惠信息		A
frg	532	data/figure/frg/2023-11-24--有色金属-神火股份-煤铝双驱，顺周期有望推动估值修复_page6_图3公司发展战略.jpg	神火股份的战略目标是什么？	做强实体经济、实现企业健康发展	煤电铝一体化，巩固优化上下游	强化资本运作、寻求投资机会		A
frg	533	data/figure/frg/2022-12-11--互联网服务-太极股份-公司首次覆盖报告：数字政府建设迎东风，信创业务发展正当时_page3_no_caption.jpg	中电太极（集团）有限公司的控股股东是谁？	中国电子科技集团	中电科投资控股有限公司	太极计算机股份有限公司		A
frg	534	data/figure/frg/2023-12-27--汽车零部件-斯菱股份-汽车后市场稳扎稳打，新业务拓展可期_page5_图表1公司发展历程.jpg	在2004-205年期间，斯菱股份的产品主要依赖哪种方式销售？	贸易商	代理商	直销		A
frg	535	data/figure/frg/2023-02-14--有色金属-神火股份-公司深度研究：专注于低成本策略，进击的铝行业专家_page15_图25神火股份铝箔业务产能图截至2022年6月30日.jpg	神隆宝鼎一期和二期的总产能是多少？	5.5万吨	6万吨	11.5万吨		C
frg	536	data/figure/frg/2022-11-22--软件开发-恒华科技-首次覆盖报告：新能源隐形IT龙头，多轮驱动有望迎业绩拐点_page7_图表8公司股权结构.jpg	罗新伟通过直接和间接持股对北京恒华伟业科技股份有限公司的持股比例是多少？	12.74%	100%	无法确定		C
frg	537	data/figure/frg/2023-03-06--家电行业-德业股份-逆变器后起之秀，拓展光储赛道迎新发展_page15_图26光伏逆变器以及储能逆变器的产业链定位.jpg	在光伏系统集成商和安装商之间，谁是主要的设备供应商？	光伏系统设计商	设备供应商	终端用户		B
frg	538	data/figure/frg/2023-05-12--半导体-芯源微-业绩同比高增，产品结构持续优化_page1_图2公司股权结构.jpg	沈阳先进制造技术产业有限公司的股东结构中，个人股东持股比例是多少？	82.86%	17.14%	0%		A
frg	539	data/figure/frg/2024-01-01--半导体-聚辰股份-深度报告：DDR5渗透加速，SPD、车规级EEPROM驱动成长_page6_图10公司股权架构截至2023年H1.jpg	图中股权占比最高的股东是以下哪一方？	陈作涛	江西和光	聚辰股份		A
frg	540	data/figure/frg/2023-07-13--通用设备-华曙高科-工业级增材设备国内龙头，高分子材料＋增材产品打开第二成长曲线_page7_图5公司股权结构图.jpg	湖南美纳科技有限公司的股东结构中，个人股东持股比例之和是否超过50%？	是	否	无法确定		A
frg	541	data/figure/frg/2023-10-16--化学制品-巨化股份-公司深度报告：氟化工有望进入长期景气周期，龙头一体化优势尽显_page5_图1巨化股份发展历程.jpg	巨化股份在2005年投资建设的生产线是哪种类型的生产线？	R134a生产线	三氯乙烯生产线	PVDF生产线		A
frg	542	data/figure/frg/2022-11-27--食品饮料-安琪酵母-公司首次覆盖报告：成本拐点，估值和业绩有望双击_page9_图11股权激励调动员工积极性管理层考核兼顾收入和利润增速为十四五规划目标护航.jpg	过去授予的股数占总股本的比例是多少？	1.07%	878万股	约8%		A
frg	543	data/figure/frg/2023-09-14--美容护理-润本股份-“庖丁解牛”拆析招股书（十九）润本股份：驱蚊赛道国货龙头，婴童护理业务未来可期_page30_图表公司部分产品扩充型号及性能升级情况.jpg	在驱蚊液系列中，哪种产品具有最长的时效？	9%避蚊胺驱蚊液	7%驱蚊酯驱蚊液	20%羟哌酯驱蚊液		C
frg	544	data/figure/frg/2023-10-16--化学制品-巨化股份-公司深度报告：氟化工有望进入长期景气周期，龙头一体化优势尽显_page28_图58公司VDC与PVDC生产工艺.jpg	在VDC生产过程中，碱液的作用是什么？	中和反应	催化作用	调节pH值		C
frg	545	data/figure/frg/2023-12-04--文化传媒-海看股份-大屏主业稳拓展，视听业态谋新篇_page15_图表28OTTTV内容提供方同集成服务平台合作情况.jpg	银河互联网电视和广东南方新媒体的合作模式是什么？	直接合作	间接授权	共同运营		B
frg	546	data/figure/frg/2023-11-27--煤炭行业-华阳股份-公司首次覆盖报告：华阳股份：立足煤炭主业，积极转型发展_page6_图1华阳股份股权结构.jpg	华阳股份的直接股东是谁？	山西省国有资本运营有限公司	中国信达资产管理股份有限公司	山西焦煤集团有限责任公司		A
frg	547	data/figure/frg/2022-12-07--酿酒行业-百润股份-预调鸡尾酒行业龙头，强爽与清爽蓄力成长_page20_图百润预调酒产品研发流程.jpg	在产品研发流程中，消费者测评环节之后的步骤是什么？	内部测评	线上试销	线下销售		B
frg	548	data/figure/frg/2023-05-18--半导体-圣邦股份-品类持续深挖，高端加速推进，模拟龙头稳健发展_page7_图2公司发展历程.jpg	2018年圣邦股份通过哪一次收购获得了大连阿尔法模拟技术和钰泰半导体？	收购上海方泰	收购上海萍生和杭州深谙	收购大连阿尔法模拟技术和钰泰半导体		C
frg	549	data/figure/frg/2022-11-22--有色金属-金田股份-铜加工与稀土永磁双轮驱动业绩增长，产品迈向高端化_page4_图1公司历史沿革.jpg	在2001年之前，金田股份的主要业务是什么？	铜加工	电工材料	无氧铜丝生产		A
frg	550	data/figure/frg/2022-10-24--光伏设备-高测股份-领军高硬材料切割，切片代工打开业绩弹性_page23_图表44中国碳化硅半导体材料产业链.jpg	在碳化硅半导体材料产业链中，哪一步骤涉及氮化镓外延？	衬底	外延	器件		B
frg	551	data/figure/frg/2022-12-30--环保行业-九州一轨-轨交减振领域专精特新企业，行稳致远_page15_图表20公司股权结构截至公司招股说明书签署.jpg	九州一轨的股东中，非个人股东持股比例之和是否超过50%？	是	否	无法确定		A
frg	552	data/figure/frg/2023-06-12--汽车零部件-豪恩汽电-投资价值分析报告_page16_图11公司股权结构图.jpg	豪恩集团的总持股比例是多少？	47.60%	99.03%	无法确定		A
frg	553	data/figure/frg/2023-10-15--汽车零部件-开特股份-汽车热管理传感器龙头，电动化、智能化有望驱动高增_page14_图表27传统汽车与新能源汽车的热管理系统对比.jpg	在传统汽车的热管理系统中，发动机热管理系统的冷却方式是什么？	压缩机、冷凝器、蒸发器、膨胀阀	对发动机的冷却	需要电子水泵作为动力源，阀类调节流量大小及流向		B
frg	554	data/figure/frg/2023-01-16--航空机场-上海机场-点评报告：合资收购日上资产，深度协同行稳致远_page2_图表1收购前日上互联UniChampion股权结构及旗下核心资产梳理.jpg	Uni-Champion的直接和间接持股比例之和是否超过50%？	是	否	不确定		A
frg	555	data/figure/frg/2023-03-20--钢铁行业-甬金股份-铢积寸累，乘势而起_page6_图表2公司股权结构截至20221114.jpg	在浙江甬金金属科技股份有限公司的实际控制人中，谁的持股比例最高？	虞纪群	曹静芬	董赵勇		A
frg	556	data/figure/frg/2023-05-15--房地产开发-华发股份-把握机遇实现规模突破，聚焦核心战略下销售拿地强势_page25_图表42华发物业服务主要业务为物业管理服务与酒店顾问及会展服务业务.jpg	2022年华发物业的基础业务服务的收入占比是多少？	65.60%	10.80%	22.80%		A
frg	557	data/figure/frg/2022-12-23--电子化学品-鼎龙股份-公司首次覆盖报告：国内CMP材料龙头，平台化发展，前景可期_page3_图1鼎龙股份正式成立于2000年2010年在创业板上市.jpg	在2010年至2022年期间，哪一年的项目投资最多？	2013年	2016年	2018年		B
frg	558	data/figure/frg/2022-12-25--汽车零部件-福达股份-曲轴领域龙头企业，受益于比亚迪混动崛起_page3_图表1公司发展历程图.jpg	福达股份在2009年3月之前成立的子公司有哪些？	桂林福达齿轮有限公司	武汉福达曲轴有限公司	上海福达汽车零部件销售有限公司		A
frg	559	data/figure/frg/2023-06-06--水泥建材-青松建化-新疆水泥龙头，有望受益自治区建设提速_page4_图2公司股权结构截止2023年一季度末主要股东控股情况.jpg	新疆生产建设兵团第一师国有资产监督管理委员会持有阿拉尔市新鑫国有资本投资运营集团的股份比例是多少？	51%	49%	36.59%		A
frg	560	data/figure/frg/2023-06-09--电子化学品-鼎龙股份-公司首次覆盖报告：高端材料平台型供应商，新品放量推动业绩稳健增长_page5_图2股权架构.jpg	图中持股比例最高的股东是以下哪一方？	其他股东	朱双全	朱顺全		A
frg	561	data/figure/frg/2023-01-26--消费电子-拓邦股份-新能源业务快速发展，盈利改善拐点已现_page14_图30公司家电智控器战略布局.jpg	根据图片内容，拓邦股份在新能源业务方面的主要优势是什么？	变频空调控制器技术占据独特优势	高研发投入推动创新产品不断涌现	拓展办公楼中央空调等商用电器品类		A
frg	562	data/figure/frg/2023-12-14--通用设备-泰嘉股份-锯切、电源双轮驱动，电源业务加速成长_page4_图3公司股权结构及子公司情况截至2023年9月3日.jpg	图中股权占比最高的股东是以下哪一方？	其他股东	方鸿	长沙正元		A
frg	563	data/figure/frg/2024-01-01--半导体-聚辰股份-深度报告：DDR5渗透加速，SPD、车规级EEPROM驱动成长_page2_图1聚辰股份产品种类.jpg	在聚辰股份的产品种类中，哪类产品主要用于存储小规模、经常需要修改的数据？	EEPROM产品	NOR Flash产品	音圈马达驱动芯片		A
frg	564	data/figure/frg/2023-11-30--有色金属-云铝股份-绿电铝一体化龙头，享受长期成本优势_page5_图2公司股权架构截至2023年6月30日.jpg	云南铝业股份有限公司的直接股东是谁？	中国铝业集团有限公司	中国铜业有限公司	云南冶金集团有限公司		C
frg	565	data/figure/frg/2022-12-19--通信设备-锐捷网络-企业网设备新贵，中小客户解决方案能力强_page16_图26锐捷网络股权结构.jpg	星网锐捷通过直接和间接持股对锐捷网络的持股比例是多少？	51%	49%	100%		A
frg	566	data/figure/frg/2023-09-11--化学制品-永和股份-氟化工产业高度集成者，含氟高分子材料激发成长动能_page9_no_caption.jpg	含氟制冷剂在中游产业链中的主要下游应用领域有哪些？	空调/汽车/冰箱等制冷设备、消防器材等	橡胶、涂料、电子电器、装备制造、建材、纺织服装等	农药、燃料、医药		A
frg	567	data/figure/frg/2022-11-30--珠宝首饰-中国黄金-央企黄金珠宝龙头，培育钻石迎来新契机，静待发布_page6_图2公司股权架构截至2022年11月.jpg	中国黄金集团有限公司的直接股东有哪些？	国务院国有资产监督管理委员会	中华人民共和国中央人民政府	其他股东		A
frg	568	data/figure/frg/2023-01-05--化肥行业-盐湖股份-钾锂双业务发展，未来成长可期_page22_no_caption.jpg	在锂镁浓缩液的处理过程中，常温吸附和常温脱附是否可以互换顺序？	不可以	可以	不确定		A
frg	569	data/figure/frg/2023-07-20--农牧饲渔-巨星农牧-进击的巨星_page5_图2巨星农牧股权结构截至1Q23.jpg	四川和邦投资集团有限公司持有乐山巨星农牧股份有限公司的股份比例是多少？	25.62%	4.19%	其他		A
frg	570	data/figure/frg/2023-09-11--化学制品-永和股份-氟化工产业高度集成者，含氟高分子材料激发成长动能_page3_公司发展历程.jpg	2004年浙江永和新型制冷剂有限公司成立时，其主要业务是什么？	主营新型环保制冷剂产品混配	收购星腾化工并更名金华永和	设立永和股份		A
frg	571	data/figure/frg/2022-11-11--纺织服装-华利集团-高效率+重研发+强运营构筑深厚壁垒，携手优质客户共同成长_page10_图4公司股权结构截至2022年9月30日.jpg	图中股权占比最高的股东是以下哪一方？	张聪渊	周美月	张志邦		A
frg	572	data/figure/frg/2022-12-07--酿酒行业-百润股份-预调鸡尾酒行业龙头，强爽与清爽蓄力成长_page19_图RIO自成立以来持续进行产品研发迭代.jpg	2016年推出的强爽系列在产品定位上与2021年推出的清爽系列有何不同？	强爽系列追求醉感，适合男性群体；清爽系列强调丰富气泡、清爽口感，适合年轻消费者。	强爽系列和清爽系列都强调低度小酒。	强爽系列和清爽系列都是针对年轻消费者的。		A
frg	573	data/figure/frg/2023-12-14--通用设备-泰嘉股份-锯切、电源双轮驱动，电源业务加速成长_page3_图1泰嘉股份发展历程.jpg	在2007年，泰嘉股份通过哪项重大事件实现了股份制改革？	收购湖南机床厂	设立印度孙公司	完成股份制改革		C
frg	574	data/figure/frg/2024-01-01--半导体-聚辰股份-深度报告：DDR5渗透加速，SPD、车规级EEPROM驱动成长_page3_图2公司产品应用场景丰富.jpg	在图中，哪一种芯片的应用场景最广泛？	EEPROM	音圈马达驱动芯片	智能卡芯片		A
frg	575	data/figure/frg/2022-12-01--燃气-新奥股份-天然气一体化龙头，波动局势中稳健发展_page10_图20天然气销售业务模式.jpg	直销模式下，上游气源主要来源于哪些资源？	国际自有/托管LNG液厂资源及非常规资源	中石油、中石化、中海油三大油资源	国内近百个LNG液厂、沿海接收站等		A
frg	576	data/figure/frg/2023-12-10--工程咨询服务-甘咨询-甘肃区域基建高景气，省内设计龙头定增再腾飞_page3_图2公司股权结构及业务布局截至23Q3末.jpg	甘肃省国有资产投资集团有限公司持有甘肃工程咨询集团股份有限公司的股份比例是多少？	57.40%	38.60%	4%		A
frg	577	data/figure/frg/2022-12-20--包装材料-昇兴股份-核心客户放量+产能持续提升，业绩有望快速释放_page6_no_caption.jpg	林永贤和林永保在昇兴控股有限公司的持股比例之和是多少？	57.94%	58.94%	60.94%		A
frg	578	data/figure/frg/2023-07-21--工程机械-诺力股份-“大车”+数字化战略助力，公司业绩弹性有待释放_page4_图2公司主要股权结构截至20230719.jpg	诺力股份的主要股东是谁？	丁毅	张科	毛敏		A
frg	579	data/figure/frg/2023-08-12--纺织服装-洁雅股份-主业有望走出低谷、第二曲线成长可期_page5_no_caption.jpg	铜陵洁雅生物科技股份有限公司的直接股东是谁？	蔡英传	明源基金	冯燕		A
frg	580	data/figure/frg/2023-05-15--房地产开发-华发股份-把握机遇实现规模突破，聚焦核心战略下销售拿地强势_page11_图表8公司多次资本运作通过IPO可转债配股定增等方式合计募集资金1512亿元.jpg	2004年2月6日的募集资金是多少？	4.218亿元	4.3亿元	25.88亿元		A
