fintype	type	index	image	md_path	background_story	information	round	question	A	B	C	D	answer
资产配置分析	frg	130433	data/figure/frg/2022-12-31--装修建材-浙江正特-正道追求特异创新，世界品牌享誉全球_page6_图2公司股权结构截至2022年9月31日.jpg					以下哪些股东直接或间接持有浙江正特股份有限公司的股权？	陈永辉	临海市正特投资管理合伙企业（有限合伙）	侯小华	浙江伟星创业投资有限公司	A;B;C;D
资产配置分析	frg	130434	data/figure/frg/2023-12-19--非金属材料-合盛硅业-公司深度报告：把握成本优势，煤电硅一体化产业延伸未来可期_page4_图2合盛硅业股权结构.jpg					以下哪些股东直接或间接持有合盛硅业股份有限公司的股份？	罗燚	富达实业公司	宁波合盛集团	其他股东	A;B;C;D
资产配置分析	frg	130435	data/figure/frg/2023-07-06---锦波生物-重组人源化胶原蛋白领航者，医疗领域打开长期成长空间_page5_图2公司股权结构截止2022年12月31日.jpg					在山西锦波生物医药股份有限公司的股权结构中，哪些股东持股比例低于2%？	刘丽萍	金雪坤	陆晨阳	任先炜	A;B;C
资产配置分析	frg	130436	data/figure/frg/2023-07-24--文化传媒-中文在线-深度报告：拥抱AIGC新时代，坚定开拓布局谋新篇_page3_图2中文在线股权穿透图.jpg					在中文在线集团股份有限公司的股权结构中，哪些股东持股比例低于5%？	中信证券	玄元私募基金	北京创造栗子	中国工商银行	A;B;C;D
资产配置分析	frg	130437	data/figure/frg/2022-12-31--旅游酒店-天目湖-首次覆盖报告：一体化布局的江南明珠，疫后扩张外延能力彰显_page5_图表2公司股权结构截至2022Q3.jpg					江苏天目湖旅游股份有限公司的直接股东有哪些？	溧阳市人民政府	孟广才	陶平	陈东海	B;C;D
资产配置分析	frg	130438	data/figure/frg/2023-02-27--酿酒行业-青岛啤酒-深度报告：打铁自身硬，一意战高端_page8_图12公司股权结构截至2022Q3.jpg					图中青岛啤酒股份有限公司的直接持股股东是以下哪些？	青岛市国资委	青岛啤酒集团有限公司	其他股东	无	B
资产配置分析	frg	130439	data/figure/frg/2023-01-09--中药-康缘药业-独家产品借政策红利有望快速增长_page5_图表2公司股权结构截止2022年三季度.jpg					以下哪些机构是江苏康缘药业股份有限公司的子公司？	上海图锋医药科技有限公司	西藏江海圣缘制药有限责任公司	连云港康贝尔医疗器械有限公司	中央汇金资产管理有限责任公司	A;B
资产配置分析	frg	130440	data/figure/frg/2023-09-24--消费电子-瑞玛精密-内生+外延双轮驱动，汽车舒适产品高速成长！_page4_图2公司股权穿透图2023年中报.jpg					以下哪些股东直接或间接持有瑞玛精密的股份？	陈晓敏	翁荣荣	前海人寿保险股份有限公司-分红保险产品	苏州工业园区众信投资企业	A;B;C;D
资产配置分析	frg	130441	data/figure/frg/2023-01-12--家电行业-德业股份-德业股份：逆变器黑马，储能+微逆双驱动_page5_no_caption.jpg					图中实际控制人张和君通过哪些公司间接持有宁波德业科技股份有限公司的股份？	艾思睿投资	亨丽投资	HKSCC	周玉平	A;B
资产配置分析	frg	130442	data/figure/frg/2023-10-16--化学制品-巨化股份-公司深度报告：氟化工有望进入长期景气周期，龙头一体化优势尽显_page27_图57巨化股份氯碱化工板块产业链图.jpg					以下哪些产品是通过液氯直接或间接生产的？	三氯甲烷	二氯甲烷	VDC	PVDF	A;B
资产配置分析	frg	130443	data/figure/frg/2022-12-23--电子化学品-鼎龙股份-公司首次覆盖报告：国内CMP材料龙头，平台化发展，前景可期_page3_图1鼎龙股份正式成立于2000年2010年在创业板上市.jpg					以下哪些年份中，公司进行了重大收购或项目投产？	2013	2016	2018	2021	A;B;C;D
资产配置分析	frg	130444	data/figure/frg/2022-12-23--能源金属-天齐锂业-资源优质，增量释放，矿冶巨头轻装再上阵_page35_图表91雅江措拉锂辉石矿股权结构.jpg					图中天齐集团直接持有天齐锂业的股权比例是多少？	28.18%	100%	50%	75%	A
资产配置分析	frg	130445	data/figure/frg/2023-10-19--中药-太极集团-改革渐入佳境，增长势能强劲_page4_图表3太极集团股权架构.jpg					以下哪些股东直接持股重庆太极集团股份有限公司的比例总和在20%-30%？	中国医药集体有限公司	重庆市涪陵国有资产投资经营集团有限公司	重庆市涪陵区国有资产监督管理委员会	中国医药有限公司	B;C
资产配置分析	frg	130446	data/figure/frg/2023-10-15--汽车零部件-开特股份-汽车热管理传感器龙头，电动化、智能化有望驱动高增_page14_图表27传统汽车与新能源汽车的热管理系统对比.jpg					以下哪些是传统汽车热管理系统中包含的子系统？	汽车空调系统	电池热管理系统	发动机热管理系统	电机电控热管理系统	A;C
资产配置分析	frg	130447	data/figure/frg/2023-03-17--美容护理-丸美股份-丸美线上转型成效渐显，恋火放量贡献新增长极_page12_图表20丸美研发体系.jpg					丸美研发中心下设的三个中心分别是？	东京前沿中心	广州研发中心	上海创新中心	北京研发中心	A;B;C
资产配置分析	frg	130448	data/figure/frg/2022-12-22--工程建设-中国化学-深度报告之二：新能源材料的技术供应商_page13_图表公司股权结构和组织架构截至2022年三季度.jpg					在中国化学工程股份有限公司的股权结构中，哪些股东持股比例低于5%？	中国证券金融股份有限公司	金石制造业转型升级新材料基金（有限合伙）	中化EB担保及信托财产专户	其他	A;B
资产配置分析	frg	130449	data/figure/frg/2023-12-25--商业百货-红旗连锁-事件点评：实控人变更为四川国资，整体经营稳定_page1_图1商投投资股权结构.jpg					以下哪些机构属于四川省国资委直接或间接控股的企业？	四川商投集团	四川省财政厅	四川乡村发展集团	四川商投投资	A;C;D
资产配置分析	frg	130450	data/figure/frg/2023-08-01--生物制品-锦波生物-功能蛋白一体化龙头，薇旖美快速放量驱动增长，敷料护肤前景可期_page6_图2公司股权结构.jpg					以下哪些股东直接持股比例在5%以上？	杨霞	任先炜	金雪坤	陆晨阳	A
资产配置分析	frg	130451	data/figure/frg/2022-12-06--食品饮料-伊利股份-首次覆盖报告：乳王地位稳固，核心竞争力优势明显_page4_图表1公司发展历程示意图.jpg					以下哪些年份是伊利股份在发展历程中具有里程碑意义的年份？	1993年	1997年	2007年	2020年	A;B;C;D
资产配置分析	frg	130452	data/figure/frg/2022-12-04--电网设备-四方股份-电网二次平台型龙头，新能源+储能注入发展新动能_page10_图9新型电力系统建设重点更多聚焦于二次设备.jpg					以下哪些设备属于发电（源）环节？	EMS（能量控制系统）	功率优化控制器	调度系统	智能电表	B
资产配置分析	frg	130453	data/figure/frg/2023-10-16--化学制品-巨化股份-公司深度报告：氟化工有望进入长期景气周期，龙头一体化优势尽显_page8_图3巨化股份股权结构图.jpg					以下哪些公司是浙江巨化股份有限公司的子公司？	浙江衢化氟化学有限公司	浙江创氟高科新材料有限公司	浙江巨化股份有限公司有机氟厂	浙江衢州联州致冷剂有限公司	A;B;C;D
资产配置分析	frg	130454	data/figure/frg/2023-06-07--半导体-卓胜微-23Q1业绩环比改善，转Fab-lite研发加速_page3_图3公司股权结构.jpg					图中股权占比前三的股东分别是谁？	无锡汇智联合投资企业（有限合伙）	TANG ZHUANG (唐壮)	FENG CHENHUI (冯晨晖)	许志翰	A;B;C
资产配置分析	frg	130455	data/figure/frg/2023-05-30--装修装饰-大丰实业-公司首次覆盖报告：打通全产业链，转型文体旅产业赋能的平台型企业_page4_图2公司股权结构稳定丰华家族拥有绝对控制权截至2023Q1.jpg					以下哪些股东直接持有浙江大丰实业股份有限公司的股份？	丰华	王小红	傅哲尔	徐吉传	A;B;C;D
资产配置分析	frg	130456	data/figure/frg/2023-04-05--工程建设-中材国际-运维优化商业模式，数字智能驱动水泥服务龙头再成长_page4_图3公司股权结构.jpg					以下哪些股东直接或间接持有中材国际的股份比例超过5%？	中国建材集团	中国建筑材料科学研究总院	凯盛科技	其他股东	A;B;C
资产配置分析	frg	130457	data/figure/frg/2023-06-02--非金属材料-尚太科技-负极盈利否极泰来，强成本控制力取胜_page5_图表3尚太科技股权结构时间截至2022年12月31日.jpg					图中直接持有石家庄尚太科技股份有限公司股份的股东有哪些？	欧阳永跃	长江晨道	招银朗曜	闵广益	A;B;C;D
资产配置分析	frg	130458	data/figure/frg/2023-07-25--航天航空-航材股份-首次覆盖报告：新材料系列#7：航空特材“航母”级平台；积累深厚资产稀缺_page11_图27航空航天特种合金及制品产业链梳理.jpg					以下哪些公司属于上游金属冶炼环节的钛合金冶炼企业？	西部超导	安吉精铸	湘投金天钛金	派克新材	A;C
资产配置分析	frg	130459	data/figure/frg/2023-02-14--有色金属-神火股份-公司深度研究：专注于低成本策略，进击的铝行业专家_page4_图2神火股份业务结构流程图.jpg					以下哪些环节是神火股份业务结构流程图中的关键步骤？	煤炭生产洗选	优质煤外销	电解铝	铝材加工	A;B;C;D
资产配置分析	frg	130460	data/figure/frg/2023-05-15--房地产开发-华发股份-把握机遇实现规模突破，聚焦核心战略下销售拿地强势_page11_图表8公司多次资本运作通过IPO可转债配股定增等方式合计募集资金1512亿元.jpg					以下哪些融资方式的募集资金总额超过20亿元？	上市	发行可转债	配股融资	定向增发（2015-1-22）	C;D
资产配置分析	frg	130461	data/figure/frg/2022-12-15--家电行业-星帅尔-公司首次覆盖报告：压缩机零部件龙头基本盘稳健，新能源业务放量拓展第二增长曲线_page5_图3公司实控人楼月根楼勇伟父子合计持有3812的股份股权结构稳定清晰.jpg					以下哪些股东直接或间接持有杭州星帅尔电器股份有限公司的股权超过5%？	楼月根	楼勇伟	卢文成	俞杰	A;B
资产配置分析	frg	130462	data/figure/frg/2023-06-19--电力行业-宝新能源-湾区民营火电龙头，盈利修复弹性逐显_page4_图表2宝新能源股权结构图截至2023Q1.jpg					广东宝丽华新能源股份有限公司的直接股东有哪些？	宁远喜	张慧强	广东宝丽华集团有限公司	香港中央结算有限公司	A;B;C;D
资产配置分析	frg	130463	data/figure/frg/2023-06-08--生物制品-凯因科技-乙肝丙肝大市场，多产品矩阵构筑护城河_page5_图3凯因科技股权结构.jpg					以下哪些公司直接持有北京凯因科技股份有限公司的股份？	高华-汇丰-GOLDMAN,SA CHS&CO.LLC	易方达基金管理有限公司 - 社保基金 2106 组	中国建设银行股份有限公司 - 信澳健康中国灵活配置混合型证券投资基金	招商银行股份有限公司 - 易方达品质动能三年持有期混合型证券投资基金	A;B;C;D
资产配置分析	frg	130464	data/figure/frg/2022-12-26--有色金属-新锐股份-公司首次覆盖报告：具备全球竞争力的矿用工具龙头，硬质合金一体化先行者_page7_图13公司凿岩工具领域产品包括牙轮钻头冲击器顶锤式钻具等.jpg					以下哪些是公司凿岩工具领域的产品？	牙轮钻头	冲击器	顶锤式钻具	旋转钻具	A;B;C
资产配置分析	frg	130465	data/figure/frg/2023-10-16--化学制品-巨化股份-公司深度报告：氟化工有望进入长期景气周期，龙头一体化优势尽显_page21_图40PVDF产业链图.jpg					以下哪些是PVDF产业链中的关键原材料？	氢氟酸	乙炔	液氯	R142b	A;B;C
资产配置分析	frg	130466	data/figure/frg/2022-11-18--电力行业-华电国际-新型电力系统下火电支撑性电源价值重估，容量电价变革火电电价机制_page11_图6公司股权结构截止到2022年9月30日.jpg					以下哪些机构直接或间接持有华电国际电力股份有限公司的股份？	国务院国有资产监督管理委员会	国家社会保险储备基金	山东发展投资控股集团有限公司	中国证券金融股份有限公司	A;B;C;D
资产配置分析	frg	130467	data/figure/frg/2023-10-15--汽车零部件-开特股份-汽车热管理传感器龙头，电动化、智能化有望驱动高增_page15_图表29传统分散式热管理系统和集成式热管理系统比较.jpg					以下关于传统分散式热管理系统和集成式热管理系统的描述，哪些是正确的？	传统分散式热管理系统中，电池系统、电驱系统和空调系统各自独立控制。	集成式热管理系统中，所有系统由一个热管理控制器统一控制。	传统分散式热管理系统中，各系统之间没有相互联系。	集成式热管理系统中，电控多通道阀门或管路用于协调各系统的工作。	A;B;D
资产配置分析	frg	130468	data/figure/frg/2022-12-25--汽车零部件-福达股份-曲轴领域龙头企业，受益于比亚迪混动崛起_page3_图表1公司发展历程图.jpg					以下哪些事件发生在2008年？	成立桂林福达齿轮有限公司	成立武汉福达曲轴有限公司	桂林福达股份有限公司在上海证券交易所成功上市	桂林福达阿尔芬大型曲轴有限公司开工奠基	A;B
资产配置分析	frg	130469	data/figure/frg/2023-11-08--化学制药-千红制药-肝素和蛋白酶龙头之一，加速创新化转型_page4_图2公司股权结构截至2023年三季报.jpg					以下哪些股东的持股比例高于5%？	王耀方	王珂	赵刚	蒋建平	A;C
资产配置分析	frg	130470	data/figure/frg/2022-12-07--酿酒行业-百润股份-预调鸡尾酒行业龙头，强爽与清爽蓄力成长_page12_图自90年代以来日本酒龙头企业持续推出预调酒产品.jpg					以下哪些产品是由三得利公司推出的？	Totteoki Kajitsuno Osaka	Hon-Shibori Chu-hi（本搾）	Horoyoi	Non arukibun	A;C;D
资产配置分析	frg	130471	data/figure/frg/2023-01-26--消费电子-拓邦股份-新能源业务快速发展，盈利改善拐点已现_page6_图3公司股权架构截至2022年9月30日.jpg					以下哪些股东直接或间接持有拓邦股份的股权比例超过5%？	武永强	纪树海	谢仁国	香港中央结算有限公司	A;D
资产配置分析	frg	130472	data/figure/frg/2023-03-06--家电行业-德业股份-逆变器后起之秀，拓展光储赛道迎新发展_page15_图26光伏逆变器以及储能逆变器的产业链定位.jpg					以下哪些是光伏系统设计商提供的主要产品或服务？	并网/储能逆变器	光伏组件、支架	配电箱、储能电池	电气设备及其他	A;B;C;D
资产配置分析	frg	130473	data/figure/frg/2023-02-17--汽车零部件-长华集团-产品升级+客户突破打造长期核心竞争力_page5_图2公司股权结构截止至2023年2月.jpg					以下哪些公司是长华集团的全资子公司？	吉林长庆	武汉长源	宁波长盛	浙江长华	A;B;C;D
资产配置分析	frg	130474	data/figure/frg/2022-12-23--能源金属-天齐锂业-资源优质，增量释放，矿冶巨头轻装再上阵_page23_图表54泰利森最新股权结构公司持股2601.jpg					以下哪些机构直接或间接持有泰利森的股份？	天齐锂业	IGO	ALB	TLEA	A;B;C;D
资产配置分析	frg	130475	data/figure/frg/2023-11-27--煤炭行业-华阳股份-公司首次覆盖报告：华阳股份：立足煤炭主业，积极转型发展_page7_图2华阳股份业务范围.jpg					华阳股份的主要业务范围包括哪些？	煤炭业务	供电供热业务	新能源、新材料业务	化工、钢铁、发电	A;B;C
资产配置分析	frg	130476	data/figure/frg/2023-02-12--中药-健民集团-公司首次覆盖报告：打造儿药优势品种，体培牛黄有望持续贡献收益_page3_图1健民集团股权结构据2022年公司三季报统计.jpg					图中股权占比前三的股东是以下哪些？	华三医药集团有限公司	中国建设银行-工银瑞信前沿混合型证券投资基金	华立集团股份有限公司	孙慧明	A;B;C
资产配置分析	frg	130477	data/figure/frg/2023-05-19--工程建设-中国电建-全球清洁能源建设龙头，投建营一体化转型重构价值_page5_图2中国电建股权结构截至2023年一季报.jpg					图中直接持股比例超过5%的股东有哪些？	国资委	电建集团	太平资产管理有限公司	中国证券金融股份有限公司	A;B
资产配置分析	frg	130478	data/figure/frg/2023-01-28--贸易行业-厦门国贸-聚焦供应链，期待高增长_page4_图3厦门国贸的股权结构关系截止2022年9月30日.jpg					以下哪些股东的持股比例高于34.66%？	厦门市国资委	厦门国贸控股	兴证资管阿尔法科睿1号	其他	A;B
资产配置分析	frg	130479	data/figure/frg/2023-05-31--通信设备-航天南湖-防空预警雷达领军者_page3_图表1公司股权结构.jpg					以下哪些股东是个人股东？	丁柏	曾鸣	郑自良	赵谦	A;B;C;D
资产配置分析	frg	130480	data/figure/frg/2023-12-04--文化传媒-海看股份-大屏主业稳拓展，视听业态谋新篇_page13_图表23微短剧产业链.jpg					以下哪些环节属于产业链上游？	IP内容版权方	拍摄制作方	发行平台方	消费者	A;B
资产配置分析	frg	130481	data/figure/frg/2023-03-06--家电行业-德业股份-逆变器后起之秀，拓展光储赛道迎新发展_page4_图2德业股份股权结构.jpg					图中直接持股比例超过20%的股东有哪些？	张和君（实际控制人）	艾思睿投资管理有限公司	亨丽投资管理合伙企业	香港中央结算有限公司	A;B
资产配置分析	frg	130482	data/figure/frg/2023-05-29--贵金属-紫金矿业-量价齐升拉动业绩增长，逆周期并购蓄势待发_page10_图表21Rosebel的股权结构.jpg					以下哪些股东直接或间接持有Rosebel矿区的股份？	紫金矿业	Sliver Source Group	RGM	UJV	A;B;C;D
资产配置分析	frg	130483	data/figure/frg/2022-12-08--医疗器械-华大智造-国产测序仪稀缺标的，广阔市场未来可期_page5_图3华大智造股权结构截至2022年9月.jpg					在华大智造的股权结构中，哪些股东持股比例低于5%？	深圳家华	西藏家华	西藏智研	深圳研家	A;B;D
资产配置分析	frg	130484	data/figure/frg/2022-12-05--工程建设-山东路桥-交通强省潜力十足，山东基建龙头再腾飞_page6_图表4公司股权结构截至2022Q3.jpg					山东高速集团有限公司直接或间接持有的山东路桥的股权比例是多少？	20%	70%	49.76%	5.93%	C;D
资产配置分析	frg	130485	data/figure/frg/2023-02-17--商业百货-王府井-老牌标杆百货零售集团，免税业务落地进入发展新篇章_page4_图320172019年王府井股权层级简化过程.jpg					以下哪些股东在2019年末直接或间接持有王府井的股份比例超过50%？	北京市国资委	首旅集团	王府井东安集团	北京国有资本经营管理中心	A;B
资产配置分析	frg	130486	data/figure/frg/2022-12-19--美容护理-水羊股份-御电商经营之道，自有+代理双业务驱动长期发展_page44_图69公司与强生旗下部分品牌合作历程图.jpg					以下哪些品牌是在2019年与公司合作的？	eisker	LISTERINE	AVEENO	ZARBEES	A;B;C;D
资产配置分析	frg	130487	data/figure/frg/2023-07-25--化学制药-一品红-儿童药、慢病药优势已定，痛风创新药AR882提升业绩天花板_page10_图表13公司股权结构截至2023年7月.jpg					以下哪些股东直接或间接持有广东广润集团的股份？	吴美容	李捍雄	广州市福泽投资管理中心（有限合伙）	西藏融创投资	A;B
资产配置分析	frg	130488	data/figure/frg/2024-01-01--半导体-聚辰股份-深度报告：DDR5渗透加速，SPD、车规级EEPROM驱动成长_page2_图1聚辰股份产品种类.jpg					以下哪些产品是聚辰股份的主要产品？	EEPROM产品	NOR Flash产品	音圈马达驱动芯片	智能卡芯片	A;B;C;D
资产配置分析	frg	130489	data/figure/frg/2023-09-24--有色金属-同享科技-光伏焊带领军企业，N型新品加速放量_page3_图2同享科技股权结构清晰稳定截至2023年6月30日.jpg					在同享（苏州）电子材料科技股份有限公司的股权结构中，哪些股东持股比例低于5%？	陆利斌	周冬菊	上海宝源胜知投资管理有限公司	其他	C;D
资产配置分析	frg	130490	data/figure/frg/2023-08-27--化纤行业-桐昆股份-公司深度报告：聚酯为基，炼化为翼，长期投资价值凸显_page4_图2桐昆股仹产品产业链.jpg					图中哪些环节属于石油化工领域？	原油	PX	POY	FDY	A;B
资产配置分析	frg	130491	data/figure/frg/2023-06-28--贸易行业-华致酒行-困境反转有望，看好公司β+α共振上行_page5_图表2公司股权结构.jpg					吴向东通过哪些公司间接持有华致酒行的股份？	西藏融睿	华泽集团	迪庆香格里拉经济开发区华泽管理有限公司	湖南金东	A;B;C;D
资产配置分析	frg	130492	data/figure/frg/2023-07-25--航天航空-航材股份-首次覆盖报告：新材料系列#7：航空特材“航母”级平台；积累深厚资产稀缺_page17_图45橡胶与密封供应商梳理.jpg					以下哪些公司是海外知名的有机硅材料和橡胶供应商？	Dow Corning	PPG工业	Trelleborg	中化sinochem	A;B;C
资产配置分析	frg	130493	data/figure/frg/2023-07-23--酿酒行业-金徽酒-西北酒王“二次创业”，蹄疾步稳扩张有方_page5_图6金徽股权结构图单位.jpg					以下哪些股东的持股比例高于20%？	亚特投资	豫园股份	众惠投资	乾惠投资	A;B
资产配置分析	frg	130494	data/figure/frg/2023-12-04--文化传媒-海看股份-大屏主业稳拓展，视听业态谋新篇_page8_图表13IPTV行业运作模式.jpg					以下哪些描述是正确的？	全国性内容平台直接向省级IPTV集成播控分平台提供内容	央视IPTV集成播控总平台负责汇总全国性内容平台的内容	省级IPTV集成播控分平台通过本省IPTV传输网络向终端用户提供服务	省内内容平台直接向终端用户提供内容	B;C
资产配置分析	frg	130495	data/figure/frg/2022-12-30--物流行业-德邦股份-聚焦大件，起航可期_page3_公司股权结构图截至2022年9月30日.jpg					以下哪些股东直接持有德邦物流股份有限公司的股权？	宿迁京东卓风企业管理有限公司	宁波梅山保税港区德邦投资控股股份有限公司	香港中央结算有限公司	其他股东	B;C;D
资产配置分析	frg	130496	data/figure/frg/2023-12-05--汽车零部件-新坐标-精密冷锻件龙头，布局全产业链发展_page6_图7新坐标股权结构.jpg					以下哪些股东是新坐标科技股份有限公司的个人股东？	何淑芬	胡欣	姚国兴	徐芳	A;B;C;D
资产配置分析	frg	130497	data/figure/frg/2023-06-30--生物制品-百克生物-首款国产带疱疫苗放量可期_page4_图表2公司股权结构截至2023年一季报.jpg					以下哪些股东直接持有长春百克生物科技股份公司股份？	孔维	魏学宁	余盛	胡尚书	A;B;C;D
资产配置分析	frg	130498	data/figure/frg/2023-12-13--塑料制品-安利股份-深度报告：PU合成革龙头企业，鞋材、汽车迎来业绩释放期_page8_图10人造革合成革产业链.jpg					以下哪些产品是通过PU合成革生产的？	男女鞋	足球/排球	笔记本/票夹	服装	A;B;C
资产配置分析	frg	130499	data/figure/frg/2023-04-18--珠宝首饰-老凤祥-百年品牌底蕴深厚，渠道及产品力推动长期成长_page6_图8老凤祥股权结构截至2022年9月底.jpg					以下哪些公司直接持有老凤祥股份有限公司的股份？	上海市黄浦区国资委	全国社保基金一一三组合	龙悦网络有限公司	其他总计	A;B;C;D
资产配置分析	frg	130500	data/figure/frg/2022-12-27--化学制品-康普化学-湿法冶炼替代逻辑演绎+新能源电池前景广阔，全球特种表面活性剂领航者_page4_图4公司股权结构.jpg					以下哪些股东的持股比例高于20%？	迈顺中心	邹扬	百朋汇金	其他股东	A;D
资产配置分析	frg	130501	data/figure/frg/2023-03-06--化学制品-光威复材-国产军用碳纤维领军企业，全链条布局产能释放在即_page7_图表2公司股权结构截至2022Q3.jpg					图中直接或间接持有威海光威复合材料股份有限公司股权的股东是以下哪些？	陈亮	陈洞	北京信奉投资中心（有限合伙）	香港中央结算有限公司	A;B;C;D
资产配置分析	frg	130502	data/figure/frg/2023-12-04--文化传媒-海看股份-大屏主业稳拓展，视听业态谋新篇_page4_图表1公司发展历程.jpg					2010-2013年期间，山东广电新媒体有限责任公司与哪些机构签订了IPTV业务合作协议？	中国网络电视台	山东广播电视台	中国联通山东分公司	中国电信山东分公司	A;B;C;D
