fintype	type	index	image	md_path	background_story	information	round	question	A	B	C	D	answer
资产配置分析	frg	130503	data/figure/frg/2023-11-30--有色金属-云铝股份-绿电铝一体化龙头，享受长期成本优势_page5_图3公司拥有绿铝全产业链布局.jpg					在绿铝全产业链布局中，哪些公司属于上游原材料供应商？	云铝文山	云南源鑫碳素	云南索通	云铝涌鑫	A;B;C
资产配置分析	frg	130504	data/figure/frg/2023-10-15--汽车零部件-开特股份-汽车热管理传感器龙头，电动化、智能化有望驱动高增_page5_no_caption.jpg					以下哪些传感器的数据被空调控制单元接收？	蒸发器温度传感器	冷却液温度传感器	车内温度传感器	车外液温度传感器	A;B;C;D
资产配置分析	frg	130505	data/figure/frg/2022-11-13--有色金属-鼎胜新材-电池铝箔高景气，龙头企业优势凸显_page4_图2公司股权结构.jpg					以下哪些股东是个人股东？	周贤海	王小丽	北京普润平方股权投资中心(有限合伙)	杭州鼎胜实业集团有限公司	A;B
资产配置分析	frg	130506	data/figure/frg/2023-08-27--化纤行业-桐昆股份-公司深度报告：聚酯为基，炼化为翼，长期投资价值凸显_page5_图3桐昆股仹股权结极.jpg					以下哪些公司直接或间接持有桐昆集团股份有限公司的股份？	浙江磊鑫实业股份有限公司	嘉兴盛隆投资股份有限公司	陈士良	恒基差别化纤维有限公司	A;B;C
资产配置分析	frg	130507	data/figure/frg/2023-01-26--消费电子-拓邦股份-新能源业务快速发展，盈利改善拐点已现_page27_图64公司新能源业务布局.jpg					图中提到的新能源业务布局中，哪些领域是公司正在积极布局的？	便携式储能	户用储能	绿色出行	锂电池技术储备	A;B;C
资产配置分析	frg	130508	data/figure/frg/2023-01-15--有色金属-常铝股份-刀片电池出鞘，新能源齐放量_page28_图表33上海朗脉历程发展图.jpg					以下哪些年份上海朗脉洁净技术股份有限公司进行了重大重组或收购？	2007	2011	2012	2018	A;B;C
资产配置分析	frg	130509	data/figure/frg/2022-12-08--半导体-圣邦股份-电源+信号链双轮驱动，Catalog模式加速企业成长_page4_图表2公司股权结构截至22Q3.jpg					以下哪些机构直接或间接持有圣邦股份的股权？	鸿顺详泰	宝利弘雅	林林	Wen Li	A;B;C;D
资产配置分析	frg	130510	data/figure/frg/2023-06-04--电池-鹏辉能源-储能引领成长，积极布局钠电_page4_图表5公司股权结构截至2023年2月.jpg					以下哪些股东在图中持有广州鹏辉能源科技股份有限公司的股份？	夏信德	夏仁德	李克文	其他	A;B;C;D
资产配置分析	frg	130511	data/figure/frg/2023-06-12--汽车零部件-豪恩汽电-投资价值分析报告_page16_图11公司股权结构图.jpg					以下哪些股东直接持有深圳市豪恩汽车电子装备股份有限公司的股份？	陈清锋	罗小平	华泰华	佳富泰	A;B;C;D
资产配置分析	frg	130512	data/figure/frg/2023-07-10--光伏设备-TCL中环-光伏半导体双驱动，技术创新引领变革_page5_图表7公司当前股权结构.jpg					以下哪些机构直接或间接持有TCL中环新能源科技股份有限公司的股份？	TCL科技集团股份有限公司	香港中央结算有限公司	TCL科技集团(天津)有限公司	其他股东	A;B;C
资产配置分析	frg	130513	data/figure/frg/2023-08-07--医疗器械-艾德生物-业绩强势复苏，海外市场高速增长_page7_图15艾德生物股权结构截止2023年半年报.jpg					以下哪些股东是个人股东？	LI-MOU ZHENG	UBS AG	厦门市屹祥投资	厦门市海沧区润鼎盛投资	A
资产配置分析	frg	130514	data/figure/frg/2023-06-01--通信设备-盛路通信-深度报告：民用通信为基，军用微波电子业务持续高增长可期_page7_图表3非公开发行未实行完毕前实控人杨华持有公司980股份.jpg					图中实际控制人杨华的持股比例是多少？	9.80%	3.94%	1.14%	0.60%	A
资产配置分析	frg	130515	data/figure/frg/2024-01-01--半导体-聚辰股份-深度报告：DDR5渗透加速，SPD、车规级EEPROM驱动成长_page9_图16存储芯片部分细分子类.jpg					以下哪些存储芯片属于非易失性存储芯片？	EEPROM	Flash	NOR Flash	NAND Flash	A;B;C;D
资产配置分析	frg	130516	data/figure/frg/2023-07-21--工程机械-诺力股份-“大车”+数字化战略助力，公司业绩弹性有待释放_page4_图1诺力发展历程.jpg					以下哪些年份诺力股份进行了重大并购或成立子公司？	2006	2013	2015	2018	B;C;D
资产配置分析	frg	130517	data/figure/frg/2022-11-20--通信设备-富士达-国内射频同轴连接器领先者，技术领先+客户资源+产能扩张促进公司发展_page3_图1公司股权结构.jpg					以下哪些公司直接或间接持有中航富士达科技股份有限公司的股份？	中国银河投资管理有限公司	金码科技责任有限公司	赛维航电科技有限公司	其他股东	A;B;C;D
资产配置分析	frg	130518	data/figure/frg/2023-06-24--橡胶制品-双箭股份-国内输送带龙头企业，产能扩张发挥规模优势_page1_图1公司发展历程.jpg					以下哪些年份是双箭股份发展历程中的重要节点？	1986年	1989年	2001年	2010年	A;B;C;D
资产配置分析	frg	130519	data/figure/frg/2023-12-01--化学制品-呈和科技-高端塑料助剂成核剂、水滑石行业龙头，国产替代主力军_page6_图2公司股权结构.jpg					以下哪些股东直接或间接持有呈和科技的股份？	赵文林	全佳奇	创钰铭晨	赫涛	A;B;C;D
资产配置分析	frg	130520	data/figure/frg/2023-04-13--医疗服务-迪安诊断-公司首次覆盖报告：“服务+产品”共振，打造特检、自产第二增长曲线_page4_图3实控人股权集中截至2022年12月6日.jpg					以下哪些公司直接或间接持有迪安诊断技术集团股份有限公司的股份？	陈海斌	香港中央结算有限公司	Citygroup Global Markets Limited	财政部	A;B;C;D
资产配置分析	frg	130521	data/figure/frg/2023-04-18--有色金属-云海金属-镁下游需求空间打开，产业链龙头依托股东优势加速扩张_page6_图3公司股权结构变动情况.jpg					在2018年宝钢金属第一次入股后，以下哪些股东的持股比例发生了变化？	梅小明	宝钢金属	其他股东	无变化	A;B
资产配置分析	frg	130522	data/figure/frg/2023-01-15--有色金属-常铝股份-刀片电池出鞘，新能源齐放量_page8_图表5公司产业规划.jpg					常铝股份的核心业务包括以下哪些领域？	工业热传递材料与热传递设备	医疗健康系统洁净技术与污染控制	新能源汽车	传统能源汽车	A;B;C
资产配置分析	frg	130523	data/figure/frg/2023-10-04--包装材料-盛通股份-卡位青少素质培训，深耕编程迎合产业方向_page3_图1盛通股份发展历程.jpg					以下哪些年份是盛通股份在印刷包装业务方面取得重要进展的年份？	2000	2011	2014	2015	A;B;C;D
资产配置分析	frg	130524	data/figure/frg/2023-01-10--商业百货-王府井-御政策东风，开新局之年_page27_图31北京国际度假有限公司股权结构.jpg					北京首寰文化旅游投资有限公司的股东有哪些？	北京首都旅游集团有限责任公司	北京国有资本运营管理有限公司	北京北控置业集团有限公司	北京新城投资运营有限公司	A;B;C;D
资产配置分析	frg	130525	data/figure/frg/2023-02-22--橡胶制品-震安科技-建筑减隔震龙头企业，行业扩容助力高速发展_page5_图表2公司股权结构图截至2022年三季度末.jpg					以下哪些机构是震安科技股份有限公司的直接子公司？	云南震安设计研究院有限公司	河北震安减隔震技术有限公司	北京凯韦铭投资咨询有限公司	中欧悦享生活混合型证券投资基金	A;B
资产配置分析	frg	130526	data/figure/frg/2023-07-13--通用设备-华曙高科-工业级增材设备国内龙头，高分子材料＋增材产品打开第二成长曲线_page7_图5公司股权结构图.jpg					图中直接持有湖南华曙高科技股份有限公司股份的股东是以下哪些？	湖南美纳科技有限公司	湖南兴旺建设有限公司	侯银华	国投（上海）科技成果转化创业投资基金企业（有限合伙）	A;B;C;D
资产配置分析	frg	130527	data/figure/frg/2023-09-14--美容护理-润本股份-“庖丁解牛”拆析招股书（十九）润本股份：驱蚊赛道国货龙头，婴童护理业务未来可期_page4_图表公司发展历程.jpg					以下哪些年份是润本股份在电子商务领域取得重要进展的年份？	2006年	2010年	2013年	2015年	B;C;D
资产配置分析	frg	130529	data/figure/frg/2023-03-20--钢铁行业-甬金股份-铢积寸累，乘势而起_page28_图表67预镀镍与后镀镍生产流程.jpg					以下哪些步骤是预镀镍生产流程中独有的？	连续预镀镍	扩散退火	精整	滚镀镍	A;B;C
资产配置分析	frg	130530	data/figure/frg/2023-09-28--珠宝首饰-周大生-产品结构顺风而变，渠道模型取长补短_page4_图表5周大生股权结构高度集中.jpg					在周大生珠宝股份有限公司的股权结构中，哪些股东持股比例低于20%？	深圳市周氏投资有限公司	深圳市金大元投资有限公司	香港中央结算有限公司	其他	B;C
资产配置分析	frg	130531	data/figure/frg/2023-10-16--化学制品-巨化股份-公司深度报告：氟化工有望进入长期景气周期，龙头一体化优势尽显_page28_图58公司VDC与PVDC生产工艺.jpg					以下哪些步骤是VDC生产过程中的关键步骤？	氯化反应	皂化反应	粗流系统	精馏冷凝	A;B;C;D
资产配置分析	frg	130532	data/figure/frg/2023-10-27--光伏设备-中来股份-三大业务驱动发展，背板龙头乘势而上_page10_图18光伏背板分类.jpg					光伏背板分类中，属于有机高分子类的有哪些？	双面复合型	单面复合型	双面涂覆型	共挤型	A;B;C;D
资产配置分析	frg	130533	data/figure/frg/2022-11-29--装修建材-兔宝宝-渠道横纵并拓，模式优化升级，板材龙头稳健成长_page6_图7兔宝宝股权结构图.jpg					以下哪些股东直接或间接持有德华兔宝宝装饰新材股份有限公司的股份？	丁鸿敏	德清县鸿基木业有限公司	吴振华等20名自然人	沈惠芳	A;B;C;D
资产配置分析	frg	130534	data/figure/frg/2023-11-23--有色金属-西部矿业-西部矿企稳健运营，顺周期助力业绩增长_page5_图1公司股权架构截至2023年Q3.jpg					以下哪些股东的持股比例高于5%？	西部矿业集团	香港中央结算	林泗华	新疆塔城国际资源	A;B
资产配置分析	frg	130535	data/figure/frg/2023-06-21--汽车零部件-岱美股份-遮阳板全球龙头，二次成长曲线拉开帷幕_page6_图表5公司股权结构.jpg					图中上海岱美汽车内饰件股份有限公司的控股股东是谁？	姜银台	姜明	其他股东	上海富善投资	A;B
资产配置分析	frg	130536	data/figure/frg/2023-12-15--汽车零部件-凌云股份-乘新能源东风，金属件+尼龙管助力公司加快发展_page10_图15新能源电池壳生产工艺.jpg					以下哪些步骤是新能源电池壳生产工艺中的关键环节？	设计	切割	装配	表面处理	A;B;C;D
资产配置分析	frg	130537	data/figure/frg/2023-04-30--化学制品-登康口腔-深耕口腔大健康领域，业绩增长稳健_page3_图2公司股权结构图.jpg					以下哪些机构直接或间接持有重庆登康口腔护理用品股份有限公司的股份？	重庆市国资委	广东温氏投资有限公司	重庆百货大楼股份有限公司	重庆轻纺控股(集团)公司	A;B;C;D
资产配置分析	frg	130538	data/figure/frg/2024-01-03--电子化学品-上海新阳-公司首次覆盖报告：晶圆及先进封装材料国内领先，高端光刻胶进展顺利_page4_图2公司股权结构稳定截止至2023年3季报.jpg					以下哪些股东直接或间接持有上海新阳的股份？	王福祥	王溯	孙江燕	其他	A;B;C;D
资产配置分析	frg	130539	data/figure/frg/2022-10-20--通用设备-海天精工-利润高速增长，数控机床龙头成长空间广阔_page6_图9公司实际控制人合计控制公司7975股权.jpg					以下哪些股东直接持有宁波海天精工股份有限公司的股权？	张静章	张静来	钱耀恩	张剑鸣	A;B;C;D
资产配置分析	frg	130540	data/figure/frg/2023-11-29--专用设备-杰瑞股份-首次覆盖报告：立足高端装备制造，压裂设备行业领军者_page4_图1杰瑞股份发展历程.jpg					杰瑞股份在哪些年份实现了重大技术突破或业务扩展？	1999	2003	2008	2014	B;C;D
资产配置分析	frg	130541	data/figure/frg/2023-02-09--光伏设备-芯能科技-工商业分布式光伏优质运营商，储能和充电桩业务有望打造新的增长点_page4_图2公司股权结构截至2022年三季度末.jpg					图中直接持有芯能科技股份的股东有哪些？	张利忠	张文娟	张震豪	戴建康	A;B;C;D
资产配置分析	frg	130542	data/figure/frg/2023-06-07--电力行业-江苏国信-长三角火电四小龙系列（一）首次覆盖报告：金融奠基，火电进击_page14_图32苏晋能源股权结构截至2022年末.jpg					以下哪些公司是苏晋能源控股有限公司的子公司？	苏晋保德煤电	苏晋朔州煤矸石发电	苏晋塔山发电	苏晋朔州新能源	A;B;C;D
资产配置分析	frg	130543	data/figure/frg/2023-09-25--化学制药-江苏吴中-转型医美，向宽而行_page5_图2江苏吴中股权结构截至2023年半年报.jpg					以下哪些股东直接或间接持有江苏吴中医药发展股份有限公司的股权？	钱群英	赵唯一	招商医药健康产业股票型证券投资基金	香港中央结算有限公司	A;B;C;D
资产配置分析	frg	130544	data/figure/frg/2022-12-26--有色金属-新锐股份-公司首次覆盖报告：具备全球竞争力的矿用工具龙头，硬质合金一体化先行者_page3_图1公司专注于硬质合金领域的技术开发.jpg					新锐股份在哪些年份获得了高新技术企业认定？	2009	2012	2015	2017	A;B
资产配置分析	frg	130545	data/figure/frg/2023-10-16--化学制品-巨化股份-公司深度报告：氟化工有望进入长期景气周期，龙头一体化优势尽显_page5_图1巨化股份发展历程.jpg					以下哪些年份巨化股份进行了重大收购或重组？	1998年	2007年	2008年	2011年	B;C;D
资产配置分析	frg	130546	data/figure/frg/2023-07-07--专用设备-日联科技-工业X射线检测设备龙头，拟追加投资微焦点射线源扩产项目_page2_图3日联科技股权结构稳定.jpg					以下哪些股东直接或间接持有日联科技的股份？	刘骏	秦晓兰	同创日联	金沙江一期	A;B;C;D
资产配置分析	frg	130547	data/figure/frg/2023-12-24--食品饮料-巴比食品-中华包点领军品牌，团餐连锁发力途中_page5_图3巴比食品股权结构截止2023Q3.jpg					哪些股东的直接持股比例超过5%？	公开发行	丁仕梅	潘和杰	刘会平	A;B;D
资产配置分析	frg	130548	data/figure/frg/2022-12-07--酿酒行业-百润股份-预调鸡尾酒行业龙头，强爽与清爽蓄力成长_page3_图百润股份历史沿革图.jpg					以下哪些年份中，RIO品牌进行了重大升级或调整？	2005	2009	2013	2018	A;C
资产配置分析	frg	130549	data/figure/frg/2022-12-26---和创科技-北交所新股简报：乘企业上云之东风，打造建筑信息化新星_page3_图表2发行人股权结构.jpg					在和创科技的股权结构中，哪些股东持股比例低于5%？	深圳市红杉瀚辰股权投资合伙企业（有限合伙）	上海万盛投资管理有限公司	图搜众智	图搜成城	B;C;D
资产配置分析	frg	130550	data/figure/frg/2023-01-26--消费电子-拓邦股份-新能源业务快速发展，盈利改善拐点已现_page9_图15公司业务增长逻辑.jpg					以下哪些业务领域在图中被划分为传统赛道？	家电智能化升级	汽车电子占比提升	工具无绳化、无刷化率提高	储能等新能源控制	A;C
资产配置分析	frg	130551	data/figure/frg/2022-12-21--半导体-杰华特-杰华特深度报告：大陆稀缺虚拟IDM玩家，率先布局服务器DCDC_page4_图表4公司股权结构.jpg					在杰华特的股权结构中，哪些股东持股比例低于5%？	香港杰华特	同赢投资	哈勃投资	英特尔	B;C;D
资产配置分析	frg	130552	data/figure/frg/2023-09-19--生物制品-药康生物-国内模式动物引领者，持续创新并开拓海外市场_page4_图表2公司股权结构及子公司情况截至2023年9月14日.jpg					江苏集萃药康生物科技股份有限公司的直接股东有哪些？	南京老岩等持股平台	青岛国药	南京生物医药谷	江苏省产业技术研究院	A;B;C;D
资产配置分析	frg	130553	data/figure/frg/2023-07-07--贵金属-紫金矿业-资源布局加速，矿业龙头稳固_page29_图表70巨龙铜业股权关系图最新.jpg					以下哪些公司直接持有西藏巨龙铜业有限公司的股份？	紫金矿业集团股份有限公司	西藏紫金实业有限公司	藏格矿业股份有限公司	知不拉铜多金属矿	B;C;D
资产配置分析	frg	130554	data/figure/frg/2023-11-29--光学光电子-德科立-产品升级和产能提升推动业绩增长_page5_图表3公司股权结构截至2023年三季度.jpg					以下哪些公司直接或间接持有无锡市德科立光电子技术股份有限公司的股份？	Taclink Germany GmbH	成都市德科立菁锐光电子技术有限公司	苏州英嘉通半导体有限公司	陕西众投湛卢二期股权投资合伙企业（有限合伙）	A;B;C;D
资产配置分析	frg	130555	data/figure/frg/2023-01-10--有色金属-明泰铝业-低成本构筑竞争优势，产品加速升级_page5_图公司股权结构图.jpg					图中实际控制人马廷义直接或间接控制的公司有哪些？	郑州明泰交通新材	河南明泰科技	昆山明泰	河南巩电热力	A;B;C;D
资产配置分析	frg	130556	data/figure/frg/2023-04-11--纺织服装-报喜鸟-公司首次覆盖报告：中高端男装领军者，多品牌运营打开成长空间_page8_图3上市初期公司股权较为分散.jpg					以下哪些股东的持股比例在5%以上？	上海正宜实业投资有限公司	浙江罗与无家河针织公司	报喜鸟集团有限公司	其他股东	A;B;C
资产配置分析	frg	130557	data/figure/frg/2023-01-11--电网设备-四方股份-电网二次平台型龙头，新能源+储能注入发展新动能_page1_图2四方股份新一代集控站解决方案.jpg					图中四方股份新一代集控站解决方案中，哪些模块属于调度系统？	D5000 AMS	CSGC-3000 WAMS	CSGC-3000 FIS	CSGC-3000 FIS/D	A;B;C;D
资产配置分析	frg	130558	data/figure/frg/2023-01-05--汽车零部件-中鼎股份-非轮胎橡胶件龙头迎增量业务快速发展期_page9_图表12空气悬架部件构成.jpg					以下哪些部件是空气悬架系统中的关键组件？	控制器含ECAS+ECD软件	前空气弹簧	后空气弹簧	气泵及支架	A;B;C;D
资产配置分析	frg	130559	data/figure/frg/2023-05-29--银行-浙商银行-净表提速风险出清，看好改革红利释放_page6_图表2浙商银行股权结构较均衡.jpg					以下哪些股东的持股比例超过5%？	浙江省金融控股有限公司	太平人寿保险有限公司	浙江恒逸集团有限公司	横店集团控股有限公司	A;D
资产配置分析	frg	130560	data/figure/frg/2023-11-29--专用设备-杰瑞股份-首次覆盖报告：立足高端装备制造，压裂设备行业领军者_page5_图4杰瑞股份股权结构.jpg					图中直接持股杰瑞股份比例超过10%的股东是以下哪些？	孙伟杰	王坤晓	刘贞峰	香港中央结算有限公司	A;B;D
资产配置分析	frg	130561	data/figure/frg/2023-07-07--贵金属-紫金矿业-资源布局加速，矿业龙头稳固_page27_图表64卡莫阿铜矿股权关系图.jpg					以下哪些股东直接或间接持有卡莫阿铜矿的股份？	紫金矿业	艾芬豪矿业	晶河全球	刚果（金）政府	A;B;C;D
资产配置分析	frg	130562	data/figure/frg/2023-01-03--酿酒行业-口子窖-积极谋求渠道变革的徽酒领军者_page5_图2口子窖股权结构示意图.jpg					以下哪些股东的持股比例高于5%？	徐进	刘安省	招商中证白酒	香港结算	A;B
资产配置分析	frg	130563	data/figure/frg/2023-12-04--文化传媒-海看股份-大屏主业稳拓展，视听业态谋新篇_page5_图表2公司股权架构截至2023Q3.jpg					哪些股东的直接持股比例在5%以上？	传媒集团	朴华惠新	中财金控	广电泛桥	A;B
资产配置分析	frg	130564	data/figure/frg/2022-12-23--能源金属-天齐锂业-资源优质，增量释放，矿冶巨头轻装再上阵_page36_图表94西藏扎布耶盐湖股权结构.jpg					以下哪些股东的持股比例超过20%？	西藏矿业	天齐锂业	比亚迪	其他	A
资产配置分析	frg	130565	data/figure/frg/2022-12-01--燃气-新奥股份-天然气一体化龙头，波动局势中稳健发展_page9_图16天然气产业链价值分配.jpg					以下哪些环节属于天然气产业链的中游仓储运输？	管道运输	LNG船运输	工业燃料	城镇燃料	A;B
资产配置分析	frg	130566	data/figure/frg/2022-12-06--贸易行业-建发股份-公司首次覆盖报告：住宅深耕核心城市群，供应链业务持续增长_page15_图30建发建管代建业务涵盖了住宅写字楼与工业园区等业态.jpg					以下哪些业务类型属于代建运营的范畴？	住宅	写字楼与工业园区	商业体与酒店	教育	A;B;C;D
资产配置分析	frg	130567	data/figure/frg/2022-11-30--软件开发-国能日新-首次覆盖报告：功率预测引领市场，新兴业务前景广阔_page10_图14公司股权结构截至2022年9月30日.jpg					图中股权占比前三的股东是以下哪些？	雍正	丁江伟	厚源广汇	财通创新	A;B;C
资产配置分析	frg	130568	data/figure/frg/2022-12-30--物流行业-德邦股份-聚焦大件，起航可期_page3_公司发展历程.jpg					以下哪些业务是德邦快递在2015年开展的？	整车	仓储与供应链	国际业务	大件快递	A;B
资产配置分析	frg	130569	data/figure/frg/2023-10-12--商业百货-小商品城-公司深度报告：向国际贸易综合服务商再升级，顺风而起佳音可期_page5_图2小商品城股权结构截至2023H1.jpg					图中直接持股比例超过50%的股东是以下哪些？	中国工商银行股份有限公司	义乌市任命政府国有资产监督管理办公室	浙江省财政厅	浙江浙财资本管理有限公司	B
资产配置分析	frg	130570	data/figure/frg/2022-10-10--医疗器械-乐普医疗-国产心血管平台型企业，创新产品布局加速_page22_图表33公司股权结构情况.jpg					乐普（北京）医疗器械股份有限公司的前三大股东是？	中船重工725所	美国WP公司	宁波厚德	其余股东	A;B;D
资产配置分析	frg	130571	data/figure/frg/2023-07-16--装修建材-永艺股份-办公椅龙头内外并进，全球产能布局领先_page4_图1公司发展历程.jpg					以下哪些年份公司进行了重大生产基地建设或扩建？	2005	2009	2014	2018	A;B;D
资产配置分析	frg	130572	data/figure/frg/2023-06-24--橡胶制品-双箭股份-国内输送带龙头企业，产能扩张发挥规模优势_page6_图9输送带产业链构成.jpg					以下哪些是输送带产业链的上游原材料？	橡胶	帆布	钢丝绳	普通输送带	A;B;C
资产配置分析	frg	130573	data/figure/frg/2023-08-27--化纤行业-桐昆股份-公司深度报告：聚酯为基，炼化为翼，长期投资价值凸显_page20_图44泰昆石化印尼有限公司持股结极.jpg					图中直接持有泰昆石化（印尼）有限公司股权的公司有哪些？	上海青翊实业发展有限公司	桐昆（香港）投资有限公司	罗科史巴克有限公司	华灿国际有限公司	B;D
资产配置分析	frg	130574	data/figure/frg/2023-05-14--半导体-金海通-国产分选机龙头企业，三温测试分选机领航国产替代_page5_图6金海通股权结构图.jpg					以下哪些机构是天津金海通半导体设备股份有限公司的全资子公司？	上海澜博	天津澜芯	江苏金海通	香港金海通 JHT DESIGN LIMITED	A;B;C;D
资产配置分析	frg	130575	data/figure/frg/2024-01-01--半导体-聚辰股份-深度报告：DDR5渗透加速，SPD、车规级EEPROM驱动成长_page9_图171GBit以下EEPROM与NORFlash应用对比.jpg					以下哪些应用领域主要使用EEPROM？	工业/通用消费	A-IoT/智能硬件	5G基站、汽车电子等	所有选项	A;B
资产配置分析	frg	130576	data/figure/frg/2022-12-13--光学光电子-路维光电-国内领先的掩膜版企业，坚持“以屏带芯”发展战略_page7_图2公司股权结构截至2022年8月16日.jpg					以下哪些股东直接或间接持有路维光电的股份？	杜武兵	成都高新投	新意资本系	白伟钢	A;B;C;D
资产配置分析	frg	130577	data/figure/frg/2023-12-15--软件开发-中控技术-纵向拓品类，横向拓行业，智能制造平台级巨轮驶向世界_page12_图表24公司实控人持股占比较高核心客户持股绑定业务关系.jpg					以下哪些公司直接持有中控技术的股份？	杭州元骋企业管理合伙企业（有限合伙）	香港中央结算有限公司	招商银行股份有限公司-华夏上证科创板50成份交易型开放式指数证券投资基金	中国石化集团资本有限公司	A;B;C;D
